company,role,salary,experience,Location,description,skills,qualification,industry_type,Functional_area,Employment_type,Role_category
"A Silicon-Valley headquartered company, Infogain is a global business oriented IT consulting provider of front-end, customer-facing technologies, processes and applications, leading to a more efficient and streamlined customer experience. We want our clients€™ interactions with their customers to be fast, efficient, and cost effective.With close to 4,000 employees in the United States, India, the Middle East, U.K., Singapore and Malaysia, we service 5 of the world€™s largest 50 companies, and 24 of the Fortune 500. we have million-dollar engagements with over 25 customers, many of which have been with us for 5 years or more.At Infogain, we place a high value on establishing long-term relationships with our clients, ultimately becoming virtual extensions of their organizations. In fact, more than 90% of our medium and large deal size clients from five years ago remain clients today. Why? Our consultants, project managers and engineering teams listen and address our clients€™ specific requirements with best-in-class solutions across a broad spectrum of service areas.Infogain is an Oracle Knowledge Management Expert, having the world€™s largest practice to improve customer support operations and boost satisfaction in High Tech, Insurance, Travel & Hospitality and Retail.We are also a global leader in Oracle Retail€™s customer facing products.For insurance companies, Infogain helps make the claims process more efficient, effective and customer friendly.","RoleData Engineer,",Not Disclosed,8 - 11 years,Noida,"Job descriptionGreeting form Infogain! We are having Immediate requirement for Azure Data Architect in Infogain India Pvt Ltd. Please Find the Job Description below & If you are interested please share your updated Resume with details:-Mode of Hiring-PermanentExperince-8-12 YrsSkills Required- ADF, SQL, MS SQL Server, SynapseNotice Period- Immediate to 30 Days MaxLocation- Noida/Bangalore/Pune/Mumbai (Currently work from home)Job Description 6+ Years experience in Azure Stack(ADF, ADLS, Synapse, Databricks, PowerBI) and strong Data Warehouse, SQL DB, Data Modelling Skills. Hands-on exposure to coding and mentor team on technical abilities Kindly share your update word formatted /pdf profile with the details below on arti.sharma@infogain.com Total exp-Exp in ADFExp in SynapseExp in DatabricksCurrent CTC:Exp CTC:NP -Current Location-Preferred Location- About Infogain:Infogain is a Silicon Valley headquartered company with expertise in software platform engineering and deep domain skills in travel, retail, insurance, automotive, and high technology. We accelerate the delivery of digital customer engagement systems using digital technologies such as cloud, microservices, robotic process automation, and artificial intelligence for our clients. Our unique engagement approach of Listen-Curate-Deliver helps to accelerate the innovation journey of 5 of the worlds largest 50 companies and 24 of the Fortune 500, with several relationships of over 10 years. We deliver positive business outcomes using rapid prototyping and a solid foundation of DevOps-based software platform engineering that ensure high-quality and on-time delivery. Our 3,500 global employees across the US, UK, Singapore, Middle East and India focus on client value creation, delivery excellence and innovation. Our locations in India have 2700 employees spanning Noida, Pune, Mumbai and Bangalore.Infogain maintains both strategic and technology partnerships with leading enterprise software providers to deliver value-added solutions. We engage with the world's largest, as well as mid-size, and startup, software providers for building product capability, product marketing, customization, professional services and post-implementation supportRoleData Engineer,Industry TypeIT Services & Consulting,Functional AreaData Science & Analytics,Employment TypeFull Time, PermanentRole CategoryData Science & Machine LearningEducationUG :Any GraduatePG :Any PostgraduateDoctorate :Any DoctorateKey SkillsAzure Data FactoryADFSkills highlighted with ‘‘ are preferred keyskills","['Azure Data Factory', 'ADF']","['UG :Any Graduate', 'PG :Any Postgraduate', 'Doctorate :Any Doctorate']","Industry TypeIT Services & Consulting,","Functional AreaData Science & Analytics,","Employment TypeFull Time, Permanent",Role CategoryData Science & Machine Learning
"Triangle ( A Unit of Ratein Infotech India Private Ltd) is a Recruitment Specialist Organisation with focus on Information Technology Industry. Incorporated in August 2000 with 4 offices in India at Mumbai, Pune, New Delhi & Bangalore, Triangle caters to more than 25 active clients who are Fortune 500 organizations and world¢??s largest IT organizations.  Our Core expertise is in End to End Permanent and Contract Staffing and Extended Services.  We have been Internationally recognized as WeConnect Certified woman owned and managed organization.  Triangle has featured in CIO Review Magazine as ¢??Company of the Year in Staffing and Recruitment¢? Category for year 2014.","RoleSolution Architect,",Not Disclosed,10 - 15 years,Bangalore/Bengaluru,"Job description   Experience in architecting with AWS or Azure Cloud Data Platform Successfully implemented large-scale data warehouse / data lake solutions in snowflake or AWS Redshift Be proficient in Data modelling and data architecture design experienced in reviewing 3rd Normal Form and Dimensional models    Experience in implementing Master data management, process design and implementation    Experience in implementing Data quality solutions including processes    Experience in IOT Design using AWS or Azure Cloud platforms    Experience designing and implementing machine learning solutions as part of high-volume data ingestion and transformation    Experience working with structured and unstructured data including geo-spatial data    Experience in technologies like python, SQL, no SQL, KAFKA, Elastic Search Hands on experience using snowflake, informatica, azure logic apps, azure functions, azure storage, azure data lake and azure search    Behaviors Required: Driven by our values and purpose in everything we do Visible, active, hands on approach to help teams be successful Strong proactive planning ability    Optimistic, energetic, problem solver, ability to see long term business outcomes    Collaborative, ability to listen, compromise to make progress    Stronger together mindset, with a focus on innovation & creation of tangible / realized value      Education      Qualifications, Accreditation, Training: Required: Degree in Computer Science and/or related fields Azure or AWS Solution Architecture certifications    RoleSolution Architect,Industry TypeRecruitment / Staffing,Functional AreaEngineering - Software & QA,Employment TypeFull Time, PermanentRole CategorySoftware DevelopmentEducationUG :Any GraduatePG :Any PostgraduateKey SkillsComputer scienceSolution architectureProcess designMachine learningData ArchitectData qualityInformaticaSQLPythonData architecture","['Computer science', 'Solution architecture', 'Process design', 'Machine learning', 'Data Architect', 'Data quality', 'Informatica', 'SQL', 'Python', 'Data architecture']","['UG :Any Graduate', 'PG :Any Postgraduate']","Industry TypeRecruitment / Staffing,","Functional AreaEngineering - Software & QA,","Employment TypeFull Time, Permanent",Role CategorySoftware Development
Eli Lilly and Company strives to create informative and engaging online communities that share information in meaningful ways. We welcome and encourage your participation and engagement in thoughtful and respectful discourse.,"RoleTechnical Architect,",Not Disclosed,5 - 7 years,Bangalore/Bengaluru,"Job description       Deep technical understanding of various data architectures and solution options along with an understanding of business requirements.    Deep understanding of cloud technologies and strategies including knowledge on cloud infrastructure (Azure/ AWS)    Ability to create roadmaps through working with multiple stakeholders Global Technology Teams and Business    Translating requirements into technical design and architecture, aligned with enterprise and industry standards and best practices, along with the corresponding required documentation.    Well-versed in both the evolving technology landscape as well as the needs of the business areas they support.    Has a deep understanding of data sources, flows, integration, acquisition, structures, quality, harmonization, and governance.    Translate business requirements into consumable data models and source to target data mapping.    Consult with internal customers who own the data to develop information relationships that lead to actionable insights.    Work with data from multiple data sources to build integrated views that will drive decisions.    Work in Agile Sprints with business facing project teams.      Additional Responsibilities        Collaborates with architects on technical design issues, particularly for solutions that impact local and global business areas    Work with Global Engineering Business Partners and Sites to understand business problems and set IT direction roadmap for solutions to meet business needs    Work with central and site engineering business partners and define processes for capture and maintaining engineering data, such as equipment metadata, supporting to the goal of creating an equipment digital twin for key process equipment sets and integration of this metadata with various sources of data.    Perform data issue analysis and work with various MQ teams to improve data quality confidence.    Serve as the technical liaison between the Bigdata Engineering admins, Data Scientists, Data Engineers and Product Owners.    Validate data quality coverage and accuracy by developing reports and tools to monitor and visualize data quality    Support the effort in finding data quality gaps by working with business and across IT domains to identify process or data management changes.    Work with Data Integration Developers to build solutions.    Work closely with the Data Integration and Analytics team to ensure we are in sync with the NextGen data lake    Develop deep understanding of technologies that enable business processes within key areas.    Develop solid understanding of business processes and needs to support recommended technical direction.    Responsible for ensuring adherence to technology roadmaps driven by the Lilly Enterprise Architecture community.    Drives decisions with respect to technologies and use of those technologies.    Ensure interface and data needs are understood and that the necessary technology and architecture are in place to meet these needs.    Responsible for understanding, influencing, and evolving the supported application(s) technical design.    Understanding of current technology as well as future direction for the area and the enterprise.        Basic Requirements      BachelorDegree and 5 yearsexperience in the implementation of modern data ecosystems.    Expertise in Python, SQL, Hadoop, Hive, Spark, UNIX Shell scripting, and Informatica big data technologies.    Expertise with JSON, REST API, and other data integration technologies.    Experience in one or more cloud-based data solutions/ cloud infrastructure    Demonstrated understanding of data privacy and CCI requirements and experience delivering within those requirements.    Experience in applying quality and compliance requirements.    Excellent oral and written communication skills.    Fluency in English.    A high level of intellectual curiosity, external perspective, and innovation interest    Strong analytical, problem solving and investigative skills    Experience with security models and development on large data sets    Excellent self-management skills.    RoleTechnical Architect,Industry TypePharmaceutical & Life Sciences,Functional AreaEngineering - Software & QA,Employment TypeFull Time, PermanentRole CategorySoftware DevelopmentEducationUG :Any GraduatePG :Any PostgraduateKey SkillsComputer scienceData managementAgileHealthcareJSONInformaticaUnix shell scriptingAnalyticsSQLPython","['Computer science', 'Data management', 'Agile', 'Healthcare', 'JSON', 'Informatica', 'Unix shell scripting', 'Analytics', 'SQL', 'Python']","['UG :Any Graduate', 'PG :Any Postgraduate']","Industry TypePharmaceutical & Life Sciences,","Functional AreaEngineering - Software & QA,","Employment TypeFull Time, Permanent",Role CategorySoftware Development
Eli Lilly and Company strives to create informative and engaging online communities that share information in meaningful ways. We welcome and encourage your participation and engagement in thoughtful and respectful discourse.,"RoleDatabase Architect / Designer,",Not Disclosed,5 - 10 years,Bangalore/Bengaluru,"Job description       Minimum 5 years Pharmaceutical Manufacturing experience.Knowledge of GxP, Supply Chain, Pharmaceutical manufacturing processes and automations systems    Minimum 5 years of relevant experience with data architecture design    Experience in Computer System Validation processes and Data Integrity concepts    Excellent communication, interpersonal, and influencing skills.    Ability to carry on conversations with business customers, upper management, and technical personnel.    Experience in working in an international and multicultural environment where team members are spread into different countries    Ability to thrive in a complex, changing, virtual environment with multiple competing priorities    Strong problem solving and organizational skills    A high level of intellectual curiosity, external perspective, and innovation interest    Strong analytical, problem solving and investigative skills    Experience with security models and development on large data sets    Demonstrated understanding of data privacy and CCI requirements and experience delivering within those requirements.    Excellent self-management skills.          Technology Background:      Experience with Agile Methodology    ITIL certification    Knowledge of best practices for code review and management in GitHub    Experience in design and development of data lakes, data warehouses, data marts and schema design    Building and maintaining complex data pipelines    Expertise in performing data extraction, profiling, cleansing, conversion, transformation and loading of data    Knowledge of CI/CD, Infrastructure as Code and more generally Everything as Code    Experience with DBMS software and tools (PostgreSQL, Oracle, Snowflake, Teradata, MS SQL Server, MongoDB, Toad, Hadoop, CouchDB, etc.)    Expertise in data management (structured/unstructured), data mining and reporting technologies    Extensive experience with data modeling using Erwin, PowerDesigner, Toad or similar software    Experience working with Amazon AWS, Microsoft Azure, Spark framework    Experience with a multitude of AWS services; especially Glue, DMS, CloudFormation, IAM, Route53, ALB/ELB, VPC, EC2, Lambda, S3, KMS, CloudTrail, Config, CloudWatch    Experience with Azure services; especially Azure Data Factory, Azure Resource Manager, Azure Synapse, Azure Functions, Azure Data Lake Analytics, Azure Data Lake Storage, Azure Monitor    Experience with SQL, PL/SQL, Python, Spark Framework, YAML, JSON, Chef    Experience with Docker, NodeJS, Ansible, Docker, Jenkins, Unix, Linux    Strong understanding of cybersecurity operation principles    Knowledge of industry standard NIST framework        Additional Preferences:      Knowledge of data science technologies like R, Keras or TensorFlow    Knowledge of ML/AI and natural language processing    Experience implementing and leading data governance    Experience working in a regulated environment    Manufacturing Operations experience preferred    Pharma Manufacturing experience strongly desired.    Multi-Site, Global IT Project Experiences strongly desired    RoleDatabase Architect / Designer,Industry TypePharmaceutical & Life Sciences,Functional AreaEngineering - Software & QA,Employment TypeFull Time, PermanentRole CategoryDBA / Data warehousingEducationUG :Any GraduatePG :Any PostgraduateKey SkillsUnixMS SQLLinuxData modelingData ArchitectPLSQLJSONOracleTeradataPython","['Unix', 'MS SQL', 'Linux', 'Data modeling', 'Data Architect', 'PLSQL', 'JSON', 'Oracle', 'Teradata', 'Python']","['UG :Any Graduate', 'PG :Any Postgraduate']","Industry TypePharmaceutical & Life Sciences,","Functional AreaEngineering - Software & QA,","Employment TypeFull Time, Permanent",Role CategoryDBA / Data warehousing
"Triangle ( A Unit of Ratein Infotech India Private Ltd) is a Recruitment Specialist Organisation with focus on Information Technology Industry. Incorporated in August 2000 with 4 offices in India at Mumbai, Pune, New Delhi & Bangalore, Triangle caters to more than 25 active clients who are Fortune 500 organizations and world¢??s largest IT organizations.  Our Core expertise is in End to End Permanent and Contract Staffing and Extended Services.  We have been Internationally recognized as WeConnect Certified woman owned and managed organization.  Triangle has featured in CIO Review Magazine as ¢??Company of the Year in Staffing and Recruitment¢? Category for year 2014.","RoleTechnical Architect,",Not Disclosed,10 - 15 years,Bangalore/Bengaluru,"Job description    Azure Data Architect with streaming experience Total experience in data management area for 10 + years with Azure cloud data platform experience        Architect with Azure stack (ADLS, AALS, Azure Data Bricks, Azure Streaming        Analytics Azure Data Factory, cosmos DB Azure synapse) mandatory expertise on Azure streaming Analytics ,Data Bricks, Azure synapse, Azure cosmos DB        Must have worked experience in large Azure Data platform and dealt with high volume Azure streaming Analytics        Experience in designing cloud data platform architecture, designing large scale environments        5 plus Years of experience architecting and building Cloud Data Lake, specifically Azure Data Analytics technologies and architecture is desired,      Enterprise Analytics Solutions. ‚Leading development of Data Lake Architectures from scratch for streaming Analytics Platform ‚5+ years of Programming experience in Python, SQL, Spark ‚Experience on Azure data explorer (ADX) is good to have it       RoleTechnical Architect,Industry TypeRecruitment / Staffing,Functional AreaEngineering - Software & QA,Employment TypeFull Time, PermanentRole CategorySoftware DevelopmentEducationUG :Any GraduatePG :Any PostgraduateKey SkillsData managementArchitectural designData ArchitectCloudProgrammingData analyticsArchitectingCosmosSQLPython","['Data management', 'Architectural design', 'Data Architect', 'Cloud', 'Programming', 'Data analytics', 'Architecting', 'Cosmos', 'SQL', 'Python']","['UG :Any Graduate', 'PG :Any Postgraduate']","Industry TypeRecruitment / Staffing,","Functional AreaEngineering - Software & QA,","Employment TypeFull Time, Permanent",Role CategorySoftware Development
" Thanks & Best Regards,Hemalatha| Lead Talent Acquisition  www.cygnuspro.comCygnusPro Software Solutions Pvt. Ltd.Tel:     04068196805Mob:  9989759380email:  hemalatha@cygnuspro.com","RoleData warehouse Architect / Consultant,",Not Disclosed,15 - 20 years,Bangalore/Bengaluru,"Job description  Exp  15 + Yrs ,  Expertise in IICS Data Integration & App Integration                              Good Data Solutioning  Experience                              Exposure to Snowflake / Data Bricks                              Exposure to Java / Python will be added advantage                                Strong stakeholder management & Communication skills                              Exposure to Informatica EDC / Axon & MDMRoles and Responsibilities Desired Candidate Profile   Exp  15 + Yrs ,  Expertise in IICS Data Integration & App Integration                              Good Data Solutioning  Experience                              Exposure to Snowflake / Data Bricks                              Exposure to Java / Python will be added advantage                                Strong stakeholder management & Communication skills                              Exposure to Informatica EDC / Axon & MDMPerks and Benefits RoleData warehouse Architect / Consultant,Industry TypeIT Services & Consulting,Functional AreaEngineering - Software & QA,Employment TypeFull Time, Temporary/ContractualRole CategoryDBA / Data warehousingEducationUG :Any GraduatePG :Any PostgraduateKey SkillsData SolutioningIICS Data Integration and App IntegrationInformatica EDC / Axon & MDMJava / PythonSnowflake / Data BricksSkills highlighted with ‘‘ are preferred keyskills","['Data Solutioning', 'IICS Data Integration and App Integration', 'Informatica EDC / Axon & MDM', 'Java / Python', 'Snowflake / Data Bricks']","['UG :Any Graduate', 'PG :Any Postgraduate']","Industry TypeIT Services & Consulting,","Functional AreaEngineering - Software & QA,","Employment TypeFull Time, Temporary/Contractual",Role CategoryDBA / Data warehousing
"Our Company is a guaranteed for its exceptional ELDF ( Enterprise Level Solution Development Firm ) for giving the particular services to different businesses with numerous physio-graphic puts over the world. We make the association for the intellectual business by working with up and coming latest advancements to serve the best client experience through customized benefits and upgraded collaboration.We are having a range of products like Customized ERP, Smart Dashboard, Audit, CRM and IOT.","RoleTechnical Architect,",Not Disclosed,8 - 15 years,Kolkata,"Job description     Good Understanding of Distributed Data Platforms.    Should have worked as data architect in Implementing a medium/large scale Data Warehouse solution.    Experience in Migrating Legacy Data Warehousing Solution to GCP Cloud.    Deep exposure hands-on GCP Cloud Native ETL / ELT services with deep understanding of BigQuery and Looker or any other reporting platform.    Possess in depth knowledge and hands on development experience operationalizing large scale ingestion, processing, consumption using either DataProc or Dataflow or cloud fusion.    Strong understanding and experience with Storage infrastructure, event-based architecture using Cloud Functions, Monitoring, Logging, Auditing services of GCP.    Strong experience on either one or more MPP Data Warehouse Platforms prefer BigQuery, CloudSQL, Cloud Spanner, Fire store or similar.    Strong Development Experience on at least one or more event-driven streaming platforms prefer PUB/SUB, Kafka   Exposure to Networking on GCP and Gateway connectivity.    Strong Data Orchestration experience using tools such has Cloud Functions, Dataflow, Cloud Composer, Apache Airflow or related.   RoleTechnical Architect,Industry TypeIT Services & Consulting,Functional AreaEngineering - Software & QA,Employment TypeFull Time, PermanentRole CategorySoftware DevelopmentEducationUG :Any GraduatePG :Any PostgraduateKey SkillsSUBorchestrationNetworkingGCPCloudData Architectcloud storageApacheData warehousingMonitoring","['SUB', 'orchestration', 'Networking', 'GCP', 'Cloud', 'Data Architect', 'cloud storage', 'Apache', 'Data warehousing', 'Monitoring']","['UG :Any Graduate', 'PG :Any Postgraduate']","Industry TypeIT Services & Consulting,","Functional AreaEngineering - Software & QA,","Employment TypeFull Time, Permanent",Role CategorySoftware Development
