company,role,salary,experience,Location,description,skills,qualification,industry_type,Functional_area,Employment_type,Role_category
"Triangle ( A Unit of Ratein Infotech India Private Ltd) is a Recruitment Specialist Organisation with focus on Information Technology Industry. Incorporated in August 2000 with 4 offices in India at Mumbai, Pune, New Delhi & Bangalore, Triangle caters to more than 25 active clients who are Fortune 500 organizations and world¢??s largest IT organizations.  Our Core expertise is in End to End Permanent and Contract Staffing and Extended Services.  We have been Internationally recognized as WeConnect Certified woman owned and managed organization.  Triangle has featured in CIO Review Magazine as ¢??Company of the Year in Staffing and Recruitment¢? Category for year 2014.","RoleTechnical Architect,",Not Disclosed,10 - 15 years,Bangalore/Bengaluru,"Job description    Azure Data Architect with streaming experience Total experience in data management area for 10 + years with Azure cloud data platform experience        Architect with Azure stack (ADLS, AALS, Azure Data Bricks, Azure Streaming        Analytics Azure Data Factory, cosmos DB Azure synapse) mandatory expertise on Azure streaming Analytics ,Data Bricks, Azure synapse, Azure cosmos DB        Must have worked experience in large Azure Data platform and dealt with high volume Azure streaming Analytics        Experience in designing cloud data platform architecture, designing large scale environments        5 plus Years of experience architecting and building Cloud Data Lake, specifically Azure Data Analytics technologies and architecture is desired,      Enterprise Analytics Solutions. ‚Leading development of Data Lake Architectures from scratch for streaming Analytics Platform ‚5+ years of Programming experience in Python, SQL, Spark ‚Experience on Azure data explorer (ADX) is good to have it       RoleTechnical Architect,Industry TypeRecruitment / Staffing,Functional AreaEngineering - Software & QA,Employment TypeFull Time, PermanentRole CategorySoftware DevelopmentEducationUG :Any GraduatePG :Any PostgraduateKey SkillsData managementArchitectural designData ArchitectCloudProgrammingData analyticsArchitectingCosmosSQLPython","['Data management', 'Architectural design', 'Data Architect', 'Cloud', 'Programming', 'Data analytics', 'Architecting', 'Cosmos', 'SQL', 'Python']","['UG :Any Graduate', 'PG :Any Postgraduate']","Industry TypeRecruitment / Staffing,","Functional AreaEngineering - Software & QA,","Employment TypeFull Time, Permanent",Role CategorySoftware Development
" Thanks & Best Regards,Hemalatha| Lead Talent Acquisition  www.cygnuspro.comCygnusPro Software Solutions Pvt. Ltd.Tel:     04068196805Mob:  9989759380email:  hemalatha@cygnuspro.com","RoleData warehouse Architect / Consultant,",Not Disclosed,15 - 20 years,Bangalore/Bengaluru,"Job description  Exp  15 + Yrs ,  Expertise in IICS Data Integration & App Integration                              Good Data Solutioning  Experience                              Exposure to Snowflake / Data Bricks                              Exposure to Java / Python will be added advantage                                Strong stakeholder management & Communication skills                              Exposure to Informatica EDC / Axon & MDMRoles and Responsibilities Desired Candidate Profile   Exp  15 + Yrs ,  Expertise in IICS Data Integration & App Integration                              Good Data Solutioning  Experience                              Exposure to Snowflake / Data Bricks                              Exposure to Java / Python will be added advantage                                Strong stakeholder management & Communication skills                              Exposure to Informatica EDC / Axon & MDMPerks and Benefits RoleData warehouse Architect / Consultant,Industry TypeIT Services & Consulting,Functional AreaEngineering - Software & QA,Employment TypeFull Time, Temporary/ContractualRole CategoryDBA / Data warehousingEducationUG :Any GraduatePG :Any PostgraduateKey SkillsData SolutioningIICS Data Integration and App IntegrationInformatica EDC / Axon & MDMJava / PythonSnowflake / Data BricksSkills highlighted with ‘‘ are preferred keyskills","['Data Solutioning', 'IICS Data Integration and App Integration', 'Informatica EDC / Axon & MDM', 'Java / Python', 'Snowflake / Data Bricks']","['UG :Any Graduate', 'PG :Any Postgraduate']","Industry TypeIT Services & Consulting,","Functional AreaEngineering - Software & QA,","Employment TypeFull Time, Temporary/Contractual",Role CategoryDBA / Data warehousing
"Our Company is a guaranteed for its exceptional ELDF ( Enterprise Level Solution Development Firm ) for giving the particular services to different businesses with numerous physio-graphic puts over the world. We make the association for the intellectual business by working with up and coming latest advancements to serve the best client experience through customized benefits and upgraded collaboration.We are having a range of products like Customized ERP, Smart Dashboard, Audit, CRM and IOT.","RoleTechnical Architect,",Not Disclosed,8 - 15 years,Kolkata,"Job description     Good Understanding of Distributed Data Platforms.    Should have worked as data architect in Implementing a medium/large scale Data Warehouse solution.    Experience in Migrating Legacy Data Warehousing Solution to GCP Cloud.    Deep exposure hands-on GCP Cloud Native ETL / ELT services with deep understanding of BigQuery and Looker or any other reporting platform.    Possess in depth knowledge and hands on development experience operationalizing large scale ingestion, processing, consumption using either DataProc or Dataflow or cloud fusion.    Strong understanding and experience with Storage infrastructure, event-based architecture using Cloud Functions, Monitoring, Logging, Auditing services of GCP.    Strong experience on either one or more MPP Data Warehouse Platforms prefer BigQuery, CloudSQL, Cloud Spanner, Fire store or similar.    Strong Development Experience on at least one or more event-driven streaming platforms prefer PUB/SUB, Kafka   Exposure to Networking on GCP and Gateway connectivity.    Strong Data Orchestration experience using tools such has Cloud Functions, Dataflow, Cloud Composer, Apache Airflow or related.   RoleTechnical Architect,Industry TypeIT Services & Consulting,Functional AreaEngineering - Software & QA,Employment TypeFull Time, PermanentRole CategorySoftware DevelopmentEducationUG :Any GraduatePG :Any PostgraduateKey SkillsSUBorchestrationNetworkingGCPCloudData Architectcloud storageApacheData warehousingMonitoring","['SUB', 'orchestration', 'Networking', 'GCP', 'Cloud', 'Data Architect', 'cloud storage', 'Apache', 'Data warehousing', 'Monitoring']","['UG :Any Graduate', 'PG :Any Postgraduate']","Industry TypeIT Services & Consulting,","Functional AreaEngineering - Software & QA,","Employment TypeFull Time, Permanent",Role CategorySoftware Development
"Triangle ( A Unit of Ratein Infotech India Private Ltd) is a Recruitment Specialist Organisation with focus on Information Technology Industry. Incorporated in August 2000 with 4 offices in India at Mumbai, Pune, New Delhi & Bangalore, Triangle caters to more than 25 active clients who are Fortune 500 organizations and world¢??s largest IT organizations.  Our Core expertise is in End to End Permanent and Contract Staffing and Extended Services.  We have been Internationally recognized as WeConnect Certified woman owned and managed organization.  Triangle has featured in CIO Review Magazine as ¢??Company of the Year in Staffing and Recruitment¢? Category for year 2014.","RoleTechnical Architect,",Not Disclosed,10 - 15 years,Bangalore/Bengaluru,"Job description    Azure Data Architect with streaming experience Job description Total experience in data management area for 10 + years with Azure cloud data platform experience Architect with Azure stack (ADLS, AALS, Azure Data Bricks, Azure Streaming Analytics Azure Data Factory, cosmos DB Azure synapse) mandatory expertise on Azure streaming Analytics ,Data Bricks, Azure synapse, Azure cosmos DB Must have worked experience in large Azure Data platform and dealt with high volume Azure streaming Analytics Experience in designing cloud data platform architecture, designing large scale environments 5 plus Years of experience architecting and building Cloud Data Lake, specifically Azure Data Analytics technologies and architecture is desired, Enterprise Analytics Solutions, and optimizing real time big data data pipelines, architectures and data sets     Job Description Architecting Microsoft Azure Solutions across multiple platforms    Implementation and Delivery of Microsoft Azure projects    Documentation of solutions (eg architecture, configuration and setup)    Working within a project management/agile delivery methodology in a leading role as part of a wider team    Experience of setting up, deploying and managing multiple environments to support agile development approaches hands-on experience with DevOps toolset    Knowledge of PowerShell, Git, ARM templates and deployment automation 10+ years of industry experience   Designing / Developing / Envisioning Enterprise apps using Azure IaaS and Analytics services with a focus on Azure RBAC, Azure AD, Azure Data Factory, Azure Data Lake Storage, Azure Function App, Azure Data Warehouse, Azure SQL DB, Azure Databricks      RoleTechnical Architect,Industry TypeRecruitment / Staffing,Functional AreaEngineering - Software & QA,Employment TypeFull Time, PermanentRole CategorySoftware DevelopmentEducationUG :Any GraduatePG :Any PostgraduateKey SkillsAutomationGITData managementPowershellProject managementAgile developmentData ArchitectArchitectural designCosmosSQL","['Automation', 'GIT', 'Data management', 'Powershell', 'Project management', 'Agile development', 'Data Architect', 'Architectural design', 'Cosmos', 'SQL']","['UG :Any Graduate', 'PG :Any Postgraduate']","Industry TypeRecruitment / Staffing,","Functional AreaEngineering - Software & QA,","Employment TypeFull Time, Permanent",Role CategorySoftware Development
"Accenture is a global professional services company with leading capabilities in digital, cloud and security. Combining unmatched experience and specialized skills across more than 40 industries, we offer Strategy and Consulting, Interactive, Technology and Operations services — all powered by the world’s largest network of Advanced Technology and Intelligent Operations centers. Our 674,000 people deliver on the promise of technology and human ingenuity every day, serving clients in more than 120 countries. We embrace the power of change to create value and shared success for our clients, people, shareholders, partners and communities. Visit us at accenture.com","RoleTechnical Architect,",Not Disclosed,12 - 15 years,Bangalore/Bengaluru,"Job description  Project Role :  Data Architect    Project Role Description :  Define the data requirements and structure for the application. Model and design the application data structure, storage and integration.    Management Level :  7    Work Experience :  12-15 years    Work location :  Bengaluru    Job Requirements :        Key Responsibilities :   1Function as the Lead Data Architect for a small, simple project/proposal or as a team lead for medium/large sized project or proposal2Discuss specific data architecture and data related issues with client architect/team in area of expertise3Analyze and assess the impact of the requirements on the data and its lifecycle4Lead the data architecture and design of complex, enterprise-level applications and systems5Breadth of experience in various client scenarios and situations     Technical Experience :   1Strong experience in Azure is preferred with hands-on experience in 2 or more of these skills : Azure SQL DB ,Azure SQL Managed Instance ,Azure Data Lake Store, Azure Cosmos DB, Azure Database for PostgreSQL, Azure Database for MySQL2Experience in handling medium to large data migration projects3 5 years of extensive database experience design build     Professional Attributes :   1Should be able to drive the technology design meetings, propose technology design and architecture 2Should have excellent client communication skills3Should have good analytical and problem-solving skills     Educational Qualification :   1Must have: BE/BTech/MCA 2Good to have: ME/MTech  RoleTechnical Architect,Industry TypeIT Services & Consulting,Functional AreaEngineering - Software & QA,Employment TypeFull Time, PermanentRole CategorySoftware DevelopmentEducationUG :B.Tech/B.E.PG :MCA in Computers, M.TechKey SkillsData migrationPostgresqlMySQLConsultingSQLArchitectureAnalyticalCosmosData architectureSkills highlighted with ‘‘ are preferred keyskills","['Data migration', 'Postgresql', 'MySQL', 'Consulting', 'SQL', 'Architecture', 'Analytical', 'Cosmos', 'Data architecture']","['UG :B.Tech/B.E.', 'PG :MCA in Computers, M.Tech']","Industry TypeIT Services & Consulting,","Functional AreaEngineering - Software & QA,","Employment TypeFull Time, Permanent",Role CategorySoftware Development
Leading Client,"RoleTechnical Architect,",Not Disclosed,11 - 14 years,Bangalore/Bengaluru,"Job descriptionJob Description : Big Data Architect Function : Data Integration Location : Off Shore / India Basic Function : - The Big Data Architect works closely with the customer and the solutions architect to translate the customer's business requirements into a Big Data solution. - This includes understanding the customer data requirements, platform selection, design of the technical architecture, design of the application and interfaces, and development, testing, and deployment of the proposed solution. - Has the ability to design enterprise grade large-scale data processing systems and help identify the best options for architecture. - The Big Data Architect also understands the complexity of data and can design systems and models to handle different variety of data with varying levels of volume, velocity and veracity. - Should have independently worked on proposing architecture, design and data ingestion concepts in a consultative mode. - Leads client assessments, preparing current state and future state architectures along with go forward recommendations. - Will work with the practice leads and account management team to develop statements of work, implementation plans, resource plans and project estimates Essential Functions : - Has a deep understanding and experience with several of the following: Business Analysis, Requirements Gathering, Data Analysis, Data Modeling, Project Management, Project Estimation - Advanced knowledge of design and architecture patterns and methodologies. - Demonstrated work ethic, focus and self-discipline - Has and maintains a deep understanding of the role of big data in business and the enterprise. - Propose recommended and/or best practices regarding the movement, manipulation, and storage of data in a big data solution including data ingestion, data storage options, query techniques, data variety, volume & velocity, - Collaborate with project teams on platform development process from inception to production deployment, including project scheduling, design, implementation and coordination with other team members. - Collaborate with other technology teams and architects to define and develop cross- function technology stack interactions. - Research and experiment with emerging technologies and tools related to big data. - Experience in scaling applications on big data platforms to massive size. - Performing solution architecture in adherence to enterprise architecture governance. - Bridging business and development team. - Long term development and Technical expertise in DW/BI Practice, communicate well with all stakeholders, optimize objectives, leverage state of the art tools and best practices, integrate into corporate systems and deliver on time. - Deep understanding in Data Warehousing, Enterprise Architectures, Dimensional Modelling, Star & Snow-flake schema design, Reference DW Architectures, ETL Architect, ETL (Extract/Transform/Load), Data Analysis, Data Conversion/Transformation, Database Design, Data Warehouse Optimization, Data Mart Development, and Enterprise Data Warehouse Maintenance and Support etc. - Should have independently worked on proposing architecture, design and data ingestion concepts. Primary Internal Interactions : Project Delivery : - Formulates workable solutions that integrate people, process and technology. Integrates competency leads and other subject matter experts to define the details of vision and solution - Identifies, creates and communicates the vision of the end-to-end solution for the client and implementation teams after completing thorough evaluations of the present state needs - Leads technical teams in documenting and implementing technical solutions for business problems - Supports Delivery Enablement and Practice Leads by ensuring appropriate linkage between practices is clear and well understood - Works with practice leads to develop project estimating methodologies for new areas of focus Account & Resource Management : - Partners with the account teams to identify and sell solutions and create high level of client interest in proposed comprehensive solutions - Works closely with Engagement Managers, Account Managers and Account Leads in strategies to grow existing accounts - Partners with account team and client to develop the ROI, Business Case, and Statement of Work for an engagement - Develops comprehensive project, implementation, and resource plans working closely with Engagement and Project Managers Primary External Interactions : Assessment Participation & Leadership : - Identifies, creates and communicates the vision of the end-to-end solution for the client and implementation teams after completing thorough evaluations of the present state needs - Participates in strategy development and current state assessments for clients to identify opportunities. Acts as proxy for practice leads when necessary - Works with client to sell the proposed solution and develop internal marketing programs - Supports work that may not fall into an existing competency and helps to identify possible needs for new competencies. - Partners with account team and client to develop the ROI, Business Case, and Statement of Work for an engagement Organizational Relationships : Reports To : EDM India Practice Lead - over time, this will evolve Supervises : NA Skills : Technical Skills (Knowledge, Skills & Abilities) : - Experience with enterprise data management, Business Intelligence, data integration, and SQL database implementations - Experience with the major big data solutions like Hadoop, MapReduce, Hive, Spark, Scala, HBase, MongoDB, Cassandra. - Programming/scripting languages like Java, Linux, PHP, Ruby, Python and/or R. As well as have experience in working with ETL tools such as Informatica, Talend, Pentaho etc. - He or she should have experience in designing solutions for multiple large data warehouses with a good understanding of cluster and parallel architecture as well as high-scale or distributed RDBMS and/or knowledge on NoSQL platforms. - Experience in data migration from relational databases to Hadoop HDFS - Propose best practices/standards - Translate, load and present disparate datasets in multiple formats/sources including JSON, XML etc. Must Have Skills : - Hadoop stack including HDFS cluster, MapReduce, Hive, Spark and Impala - Web Technologies CSS, DHTML, XML, Hight Charts, Linux - ETL tools such as Informatica, Talend and/or Pentaho. Query : SQL, No SQL Concepts Ingest : Kafka, Sqoop, Flume Orchestration : Zookeeper Databases : Postgres, Mongo DB, Cassandra, HBase Languages : Java, Scala Scripting : JavaScript, DHTML, XML, Shell Good to have Skills : Core : AWS, Hadoop, Yarn Process : Agile-Scrum, Iterative Development, DevOps, CI Analytics : Descriptive, Predictive (Added advantage) Tools : Jenkins and TFS Languages : Python, Java Enterprise Process Specific Skills : (Supervisory Responsibilities) : - When the Bigdata Architect is acting as an engagement or project manager, they will be responsible for the overall supervision of the staff on the engagement.- They will be responsible for coaching and advising the team on the engagement. They will likely need to provide feedback to the people managers and practice leads of the resources on their engagement team. Soft skills (Desired) :- Experience working with multi-divisional business communities to leverage information across the enterprise to improve business effectiveness - Strong team building, interpersonal, analytical, problem identification and resolution skills Soft Skills (Minimum) : - Exceptional analytical, conceptual, and problem-solving abilities - Strong written/oral communication and presentation/interpersonal skills - Highly self-motivated and able to work independently as well as in a team environment Education Requirements : Bachelor's degree or Master's degree Work Experience Requirements : - Minimum 10 years of professional experience with BI/DW implementations and with at least 2-3 years of Big Data Architecture. - 3+ years of experience in technical or solution architecture providing large scale enterprise data solutions. RoleTechnical Architect,Industry TypeIT Services & Consulting,Functional AreaEngineering - Software & QA,Employment TypeFull Time, PermanentRole CategorySoftware DevelopmentEducationUG :Any GraduatePG :Any PostgraduateDoctorate :Doctorate Not RequiredKey SkillsDatabase MaintenanceTechnical ArchitectBig Data ArchitectBusiness IntelligenceHadoopBig DataDatabase DesignData AnalystData WarehousingData ModelingMapReduceSkills highlighted with ‘‘ are preferred keyskills","['Database Maintenance', 'Technical Architect', 'Big Data Architect', 'Business Intelligence', 'Hadoop', 'Big Data', 'Database Design', 'Data Analyst', 'Data Warehousing', 'Data Modeling', 'MapReduce']","['UG :Any Graduate', 'PG :Any Postgraduate', 'Doctorate :Doctorate Not Required']","Industry TypeIT Services & Consulting,","Functional AreaEngineering - Software & QA,","Employment TypeFull Time, Permanent",Role CategorySoftware Development
"We Are Brillio. Born of the digital age in 2014. We are laser-focused on turning technological disruptions into the advantages that our customers need to thrive in todays digital economy.Brilliois a company focused on digital technologies andbig dataanalytics headquartered inSanta Clara, California, United States","RoleDatabase Architect / Designer,",Not Disclosed,6 - 10 years,Bangalore/Bengaluru,"Job description  BSc or MSc (preferred) in a STEM field Relevant work experience of 5 years Fluency in Python (especially Numpy and Pandas) and familiarity in PySpark Extensive hands-on experience with AWS Analytical Components like S3, EC2, Lambdas, Glue, SQS, SNS, DynamoDB, Redshift, RDS etc.    Experience with Data Lake Formation and Athena    Work Experience with industry standard distributed systems (ie    Spark, hive), data pipeline tools (ie    Airflow), NoSQL Databases (DynamoDB) and databases (PostgreSQL) Experience with Data Analysis, Significant experience optimizing data retrieval processes supporting API output, ideally within a low query volume / high data volume environment    Demonstrably deep experience with relevant big data processing either via Spark or through a modern MPP database like Redshift, ideally with experience in both Demonstrably deep experience with CI/CD tools and practices in a containerized AWS environment, from deployment pipelines (Jenkins, etc), infrastructure definition (Terraform, CloudFormation, etc    Understand and design for non-functional concerns such as performance, cost optimization, maintainability, and developer experience.             RoleDatabase Architect / Designer,Industry TypeIT Services & Consulting,Functional AreaEngineering - Software & QA,Employment TypeFull Time, PermanentRole CategoryDBA / Data warehousingEducationUG :Any GraduatePG :Any PostgraduateKey SkillsData analysisNoSQLAnalyticalPostgresqlData ArchitectData processingbig dataDistribution systemCost optimizationPython","['Data analysis', 'NoSQL', 'Analytical', 'Postgresql', 'Data Architect', 'Data processing', 'big data', 'Distribution system', 'Cost optimization', 'Python']","['UG :Any Graduate', 'PG :Any Postgraduate']","Industry TypeIT Services & Consulting,","Functional AreaEngineering - Software & QA,","Employment TypeFull Time, Permanent",Role CategoryDBA / Data warehousing
