company,role,salary,experience,Location,description,skills,qualification,industry_type,Functional_area,Employment_type,Role_category
"Campus Management, Campus Labs, and iModules have joined together to create Anthology, a brand new company offering industry-leading solutions to better support the ever-changing needs of Higher Education.","RolePre Sales Consultant,",Not Disclosed,3 - 7 years,Bangalore/Bengaluru,"Job description                 Maintain   ing   expert level knowledge and proficiency in a range     o   f     products including their functionality, application, administration   ,   and deployment methodologies       Maintain   ing   familiarity with our partner solutions and know   ing   when to propose them as part of a customer solution set       Participat   ing   in client discovery calls, listen   ing   to customer needs, and creat   ing   account value proposals that relate Anthology solutions to customers strategic goals and initiatives       Manag   ing   and deliver   ing   high quality technical validation events (   d   emonstrations,    e   valuations,    p   ilots) to include tailoring the solution, configuration   ,   and data to support customer requirements       Work   ing   with all members of the regional sales teams to articulate product strategic value, develop client-focused solutions, and document solutions in proposals       Build   ing   and maintain   ing   Anthology champions in our customer/user community to include participation in trade shows, conferences,     user     groups, virtual events, etc.       Provid   ing   rapid, accurate responses to questions from sales teams and channel partners       Provid   ing   insight, feedback, and recommendations to improve Anthology s ability to respond to customer challenges       Develop   ing   and deliver   ing   responses to RFPs/RFIs      This role requires 40-50% travel           The Candidate:     Required skills/qualifications:       Bachelor   s     degree (or equivalent) in Information Technology Management, Instructional Design or other education-related field      Understanding of the application of instructional technologies to varied teaching and learning environments, especially assessment and accreditation      Understanding of enterprise level IT infrastructure, deployment methodologies   ,   and cloud/SaaS environments      3 years of pre-sales experience, preferably in enterprise sales and/or education technology     Strong oral and written communication skills      Exceptional ability to present to small and large groups of people who may have varied roles, experience   ,   and perspectives       Ability   to work independently in a geographically dispersed team and be self-motivated      Proven ability to engage effectively at the executive-level     Fluency in written and spoken English              Preferred skills/qualifications:      Advanced degrees      Fluency in languages local to Asia Pacific region                         RolePre Sales Consultant,Industry TypeEducation / Training,Functional AreaSales & Business Development,Employment TypeFull Time, PermanentRole CategoryBD / Pre SalesEducationUG :Any GraduatePG :Any PostgraduateKey SkillsExecutiveInstructional designIT infrastructureManager TechnologyRegional salesPresalesInformation technology managementDeploymentManagementEnterprise sales","['Executive', 'Instructional design', 'IT infrastructure', 'Manager Technology', 'Regional sales', 'Presales', 'Information technology management', 'Deployment', 'Management', 'Enterprise sales']","['UG :Any Graduate', 'PG :Any Postgraduate']","Industry TypeEducation / Training,","Functional AreaSales & Business Development,","Employment TypeFull Time, Permanent",Role CategoryBD / Pre Sales
"Bajaj Finserv Lending offers loans for various needs. We offer loans for Bajaj Auto Two Wheelers under the name of Bajaj Auto Finance Ltd. We offer Consumer Durable Loans, Personal Loans, Loan Against Property, Small Business Loans, Construction Equipment Loans, Loan Against Securities and Insurance Services under the name of Bajaj Finserv Lending.

Bajaj Finserv Lending is one of the most diversified NBFCs in the market catering to more than 5 million customers across the country. Apart from being a well recognized organization, we pride ourselves for holding the highest credit rating of FAAA/Stable for any NBFC in the country today. Our product offerings include Consumer Durable Loans, Personal Loans, Loan Against Property, Small Business Loans, Two-wheeler and Three-wheeler Loans, Construction Equipment Loans, Loan Against Securities and Insurance Services.","RoleBranch Sales Executive,",Not Disclosed,1 - 4 years,Hyderabad/Secunderabad,"Job description Job ResponsibilitiesDuties and ResponsibilitiesPRINCIPAL ACCOUNTABILITIES (Accountabilities associated with the job)Achieving business numbers with the assigned line of channels (Basis location and market potential).People Management (Off roll)  Hiring Retention & Productivity.Sales Governance through compliance of systems and processes.Responsible for tracking  managing & controlling PDD requirement complianceReduction in customer complaints & cancellation by ensuring that no miss-selling is being doneUnderstanding of CRM  Salesforce.com.Effectively engage with Credit Operations & Risk teams.To ensure TAT is maintained for case processing.Job LocationMaharashtraKarnatakaGujaratTelanganaRoleBranch Sales Executive,Industry TypeNBFC,Functional AreaSales & Business Development,Employment TypeFull Time, PermanentRole CategoryEnterprise & B2B SalesEducationUG :Any GraduateKey Skillssalessales managementloanTwo Wheeler LoanSkills highlighted with ‘‘ are preferred keyskills","['sales', 'sales management', 'loan', 'Two Wheeler Loan']",['UG :Any Graduate'],"Industry TypeNBFC,","Functional AreaSales & Business Development,","Employment TypeFull Time, Permanent",Role CategoryEnterprise & B2B Sales
"Bajaj Finserv Lending offers loans for various needs. We offer loans for Bajaj Auto Two Wheelers under the name of Bajaj Auto Finance Ltd. We offer Consumer Durable Loans, Personal Loans, Loan Against Property, Small Business Loans, Construction Equipment Loans, Loan Against Securities and Insurance Services under the name of Bajaj Finserv Lending.

Bajaj Finserv Lending is one of the most diversified NBFCs in the market catering to more than 5 million customers across the country. Apart from being a well recognized organization, we pride ourselves for holding the highest credit rating of FAAA/Stable for any NBFC in the country today. Our product offerings include Consumer Durable Loans, Personal Loans, Loan Against Property, Small Business Loans, Two-wheeler and Three-wheeler Loans, Construction Equipment Loans, Loan Against Securities and Insurance Services.","RoleBranch Sales Executive,","₹ 1,00,000 - 4,25,000 P.A. ",0 - 2 years,Chennai,"Job description Job Summary Assistant Manager : Fixed Deposits.LOCATIONS :  Mumbai, Delhi, Bangalore and PAN India. Job Duties & Key ResponsibilitiesResponsible for managing and upkeep of the branchCross-sell/Upsell FD & other investment productsAcquisition targetCatchment area mappingData distributions to PSFsConduct localized marketing events. Required Qualifications And Experience2-3 years of experience in customer relationship managementPrevious exposure/knowledge of customer service is essentialExperience of establishing and maintaining relationships with business units / managers for managing day-to-day businessAbility to effectively communicate and implement policies and proceduresAbility to manage a team across a diverse range of processes within an operational environment.Ability to maintain control, direction and motivation of staff in an ever-changing environment.Intrested Candidates please share your Cvs on rohilla.monika@bizsupporta.comBajaj Finserv Founded in April 2007, Bajaj Finserv is the financial arm of the Bajaj group. We believe in a simple philosophy to never settle for good and go for great. This reflects in our extensive product portfolio that spans across 3 broad categories- lending, insurance and wealth advisory. With 24 products spread across 12 product lines, we're one of the fastest growing and most diversified NBFCs in India. Our footprint spans the length and breadth of India. RoleBranch Sales Executive,Industry TypeBanking,Functional AreaSales & Business Development,Employment TypeFull Time, PermanentRole CategoryEnterprise & B2B SalesEducationUG :Any GraduateKey SkillsSalesFixed DepositsSkills highlighted with ‘‘ are preferred keyskills","['Sales', 'Fixed Deposits']",['UG :Any Graduate'],"Industry TypeBanking,","Functional AreaSales & Business Development,","Employment TypeFull Time, Permanent",Role CategoryEnterprise & B2B Sales
.,"RoleAudit Manager,","₹ 7,00,000 - 13,00,000 P.A. ",2 - 7 years,Gurgaon/Gurugram,"Job descriptionRoles and Responsibilities Assisting inspection of engagements (Cold reviews, Hot reviews), coordinating with engagement teams for the same, assisting in rating review comments, grading the files reviewed, performing root cause analysis, assisting in preparing the report for reporting to leadership, planning for trainings basis review findings etc.Assisting in drafting policies and procedures, coordinating with other service lines, assisting in performing gap analysis in existing polices as per ISQM and drafting updated polices, assisting in performing risk assessment at firm level, testing operating effectiveness of SOQM on periodic basis, carrying our surveys, collating information and assisting in preparing the report for reporting to leadership on compliance with quality standards etc. Desired candidate Candidate should have relevant experience of 3 to 5 years preferably in Audit & Assurance function in a reputed CA firm.Candidate should have sound knowledge of Audit Methodology, auditing standards, accounting standards (IGAAP, Ind-AS, IFRS and US GAAP), Companies Act, etc. RoleAudit Manager,Industry TypeManagement Consulting,Functional AreaFinance & Accounting,Employment TypeFull Time, PermanentRole CategoryAudit & ControlEducationPG :CA in Any SpecializationKey SkillsStatutory AuditExternal AuditIGAAPGAAPIFRSaccounting standardsSkills highlighted with ‘‘ are preferred keyskills","['Statutory Audit', 'External Audit', 'IGAAP', 'GAAP', 'IFRS', 'accounting standards']",['PG :CA in Any Specialization'],"Industry TypeManagement Consulting,","Functional AreaFinance & Accounting,","Employment TypeFull Time, Permanent",Role CategoryAudit & Control
"Marriott International, Inc. is based in Bethesda, Maryland, USA, and encompasses a portfolio of more than 7,500 properties in 30 leading hotel brands spanning 132 countries and territories. Its heritage can be traced to a root beer stand opened in Washington, D.C., in 1927 by J. Willard and Alice S. Marriott.Marriott International is an equal opportunity employer committed to hiring a diverse workforce and sustaining an inclusive culture. Marriott International does not discriminate on the basis of disability, veteran status or any other basis protected under federal, state or local laws.Community Guidelines: We reserve the right to remove without any notice content that we determine in our sole discretion is offensive or illegal, contains personally identifiable information, trademarks or copyrights belonging to a third party, advertises a third partys products or services, or is otherwise inappropriate.","RoleIT Operations Management,",Not Disclosed,5 - 7 years,Bangalore/Bengaluru,"Job description   In addition to the functions of a property systems manager, the Director of property Technology manages a revenue-generating function in a large property or multiple properties with a shared infrastructure. Works with property management and Regional IR leadership to participate in the acquisition of technology services for guests through an understanding of the properties specific business/customer base (i.e., convention). Provides strategic leadership for IR services surrounding initiatives and projects and coordinates with regional IR leadership on systems/services to enhance services in a specific property. May have direct reports (property systems manager, property systems technicians) or direct work of on-site shared services staff.      CANDIDATE PROFILE       Education and Experience    BS/BA or equivalent work experience. Additionally, 5-7 years experience in like position.   System-related professional certifications preferred.   Previous management experience and demonstrated matrix management skills   Experienced in network hardware, desktop, peripherals, protocols, communications, operating systems and Marriott internal applications (MARSHA, PMS, NGS, SFA, etc)      CORE WORK ACTIVITIES       Managing Projects and Policies     Functions as on-site project manager who plans and manages both new systems and system upgrades for property site.   Performs assessments of needs ensuring compliance with budget, standards.   Determines priorities, schedules, plans and necessary resources to ensure completion of property projects on schedule and according to specification.   Prepares project plans and monitors on-site.   Coordinates multiple-vendor projects.   Verifies compliance to technology-related vendor contracts.   Responsible for property compliance with appropriate Marriott International Policy and Information Security Manual. Accountable to take action to address deficiencies. Determines solutions and implements per SOP.   Provides timely, accurate, and detailed status reports as requested.      Meeting Technology Needs    Evaluates and makes recommendations regarding technology/asset life-cycles. Verifies that necessary property is properly equipped in terms of PCs, hardware, servers, etc   Foresees, identifies and resolves system(s) performance problems.   Certifies software applications for use at property.   Creates and verifies implementation of disaster recovery and business continuity plans as they relate to technology.   Verifies property s technology assets are secure and maintained in accordance with Marriott International policies and standards.   Possesses advanced knowledge in the areas of data communications, desktop support, and servers/networks. Uses knowledge to solve 2nd level support issues and train/develop junior staff.   Verifies availability of current documentation for cabling, network systems, and applications exist.   Reviews networks performance and performs design/re-design as needed to meet property needs.   Verifies that periodic inventories of applications and hardware are conducted.      Forecasting and Complying with Financial Parameters    Analyzes, communicates and implements property strategy to drive technology revenue and contribute to property s overall business success.   Manages technology profit and loss. Responsible for monitoring and controlling all technology-impacted revenues and expenses generated by the property including, but not limited to: telecommunications, HSIA, business center technologies and A/V.   Verifies that property management has realistically budgeted CAPEX and department operating budgets based on anticipated IT projects and property support/needs requirements.   Advises and verifies that property management has adequately addressed technology needs in short- and long-term planning.   Reviews vendor proposals and selects appropriate vendor for technologies/hardware.      Building Successful Relationships    Communicates IR standards and best practices.   Is expected to present proposals, analyses, projects, cost-models, etc in a well- written and/or verbally articulate manner.   Is viewed as a credible leader by subordinates, peers, and senior management.   Provides exceptional customer service.      Managing and Conducting Human Resource Activities     May have direct management responsibility for property-based system managers and technicians. Provides work direction to cluster--based systems technicians and managers.   Responsible for hiring, training, development, compensation, performance management of direct reports. Additionally, provides performance feedback to Area System Manager on cluster support positions.   RoleIT Operations Management,Industry TypeTravel & Tourism,Functional AreaIT & Information Security,Employment TypeFull Time, PermanentRole CategoryIT Infrastructure ServicesEducationUG :Any GraduatePG :Any PostgraduateKey SkillsPerformance managementInformation securityDisaster recoveryHRCustomer serviceProperty managementBusiness continuityInformation technologyForecastingMonitoring","['Performance management', 'Information security', 'Disaster recovery', 'HR', 'Customer service', 'Property management', 'Business continuity', 'Information technology', 'Forecasting', 'Monitoring']","['UG :Any Graduate', 'PG :Any Postgraduate']","Industry TypeTravel & Tourism,","Functional AreaIT & Information Security,","Employment TypeFull Time, Permanent",Role CategoryIT Infrastructure Services
Arrow Electronics India Pvt ltd,"RoleIT Project Manager,",Not Disclosed,5 - 7 years,Bangalore/Bengaluru,"Job description   ERP Analyst provides project coordination, functional expertise, and contributes to improvements and enhancements for mission-critical, enterprise-wide information systems.   The ERP Analyst is responsible for project tracking and control for assigned modules or systems, serving as a liaison between functional and technical resources to manage the development of new system functionality, upgrades, system modifications, and day-to-day problem analysis, issue tracking, and resolution.   Solves complex problems; takes a new perspective using existing solutions   Works independently; receives minimal guidance   Acts as a resource for colleagues with less experience   Represents the level at which career may stabilize for many years or even until retirement   Contributes to process improvements   Typically resolves problems using existing solutions   Provides informal guidance to junior staff   Works with minimal guidance       What We Are Looking For     Typically requires 5-7 years of related experience with a 4 year degree; or 3 years and an advanced degree; or equivalent work experience.   Requires in-depth knowledge and experience - MS-AX functional       What s In It For You     Training and professional development   Performance coaching   Work with fun team in a supportive environment   Work at a strong and growing company   Community involvement opportunities   RoleIT Project Manager,Industry TypeHardware & Networking,Functional AreaProject & Program Management,Employment TypeFull Time, PermanentRole CategoryTechnology / ITEducationUG :Any GraduatePG :Any PostgraduateKey SkillsJunior StaffProject trackingERP AnalystManager Information TechnologySalesInformation Technology AssociateProject coordinationTechnology solutionsManagementInformation technology","['Junior Staff', 'Project tracking', 'ERP Analyst', 'Manager Information Technology', 'Sales', 'Information Technology Associate', 'Project coordination', 'Technology solutions', 'Management', 'Information technology']","['UG :Any Graduate', 'PG :Any Postgraduate']","Industry TypeHardware & Networking,","Functional AreaProject & Program Management,","Employment TypeFull Time, Permanent",Role CategoryTechnology / IT
Arrow Electronics India Pvt ltd,"RoleBusiness Development Manager (BDM),",Not Disclosed,4 - 7 years,Bangalore/Bengaluru,"Job description   What You ll Be Doing     X++ dev best practises, Batch/ SysOperation/Dimension framework / posting / Eventing / IDMF / Document Attachment / Credit card payments/Address book / Date effective/XDS/Number Sequence /Organization Model / Policy   Framework /Alerts / initFrom / Multi-threading   How to debug a batch   How to use Maps   How to use XLST for exporting different bank file formats       What We Are Looking For    The candidate should/must possess below skillset for the position of Associate Manager:    MUST be Technically strong in X++ {Non-Advance areas}   SSRS, DIXF, Trace parser, Security roles, Workflow, AIF etc..   MUST be Technically good in X++ advanced areas   MUST possess skills to perform strict and efficient Code Reviews    MUST possess skills to translate the Functional Design Document into a good scalable technical design and should be able to challenge the developer where applicable regarding the same   MUST possess soft skills to interact with the team, hold them accountable for their work   MUST possess skills to review the technical design documents   Good to have worked in the on-shore offshore model in the past to quickly pickup, adjust and understand the challenges he/she may come across   Willing to work in CET time zone even if from home because of COVID restrictions   Should have good knowledge of Change Management process   Should have past experience of managing a dev team   Having some experience in Production Support is good to have. {but not mandatory}   Should have fluent communication and interpersonal skills   RoleBusiness Development Manager (BDM),Industry TypeHardware & Networking,Functional AreaSales & Business Development,Employment TypeFull Time, PermanentRole CategoryBD / Pre SalesEducationUG :Any GraduatePG :Any PostgraduateKey SkillsChange managementManager Information TechnologyProduction supportInformation Technology AssociateTechnical designSSRSWorkflowX++Technology solutionsInformation technology","['Change management', 'Manager Information Technology', 'Production support', 'Information Technology Associate', 'Technical design', 'SSRS', 'Workflow', 'X++', 'Technology solutions', 'Information technology']","['UG :Any Graduate', 'PG :Any Postgraduate']","Industry TypeHardware & Networking,","Functional AreaSales & Business Development,","Employment TypeFull Time, Permanent",Role CategoryBD / Pre Sales
Arrow Electronics India Pvt ltd,"RoleIT Operations Management,",Not Disclosed,8 - 11 years,Bangalore/Bengaluru,"Job description   Job Complexity    Manages professional employees and/or supervisors or supervises large, complex technical or business support or production operations team(s)  Is accountable for the performance and results of a team within own discipline or function  Adapts departmental plans and priorities to address resource and operational challenges    Decisions are guided by policies, procedures and business plan; receives guidance from senior manager  Provides technical guidance to employees, colleagues and/or customers  Accountable for results of a small team   Exercises limited management authority; sets employee performance objectives, conducts performance reviews and recommends pay actions   Defines team operating standards and ensures essential procedures are followed based on knowledge of own discipline      What we are looking for:      Typically requires a minimum of 8 years of related experience with a 4 year degree; or 6 years and an advanced degree; or equivalent experience.      RoleIT Operations Management,Industry TypeHardware & Networking,Functional AreaIT & Information Security,Employment TypeFull Time, PermanentRole CategoryIT Infrastructure ServicesEducationUG :Any GraduatePG :Any PostgraduateKey SkillsCareer developmentData analysisPerformance managementProject managementProduction operationsBusiness process analysisTechnology solutionsInformation technologyOperationsPrincipal","['Career development', 'Data analysis', 'Performance management', 'Project management', 'Production operations', 'Business process analysis', 'Technology solutions', 'Information technology', 'Operations', 'Principal']","['UG :Any Graduate', 'PG :Any Postgraduate']","Industry TypeHardware & Networking,","Functional AreaIT & Information Security,","Employment TypeFull Time, Permanent",Role CategoryIT Infrastructure Services
