company,role,salary,experience,Location,description,skills,qualification,industry_type,Functional_area,Employment_type,Role_category
Arrow Electronics India Pvt ltd,"RoleTechnical Lead,",Not Disclosed,6 - 9 years,Bangalore/Bengaluru,"Job description    What You ll Be Doing      Manage a team of IT professionals that define, develop, and maintain information systems within the organization.   Coordinate studies and implement new procedures and techniques.   Supervise team members; respond to complex, escalated enquiries; and check the work of others to ensure projects are conducted effectively and recommendations and reports are accurate and timely.   Prioritize and assign tasks to ensure that the teams resources are used effectively and that work schedules and targets are met.   Manage a team of 20+ resources during night shift (Providing coverage during US hours from India)   Well versed with production support modalities, driving bridge call, handling P1 issues, continuous improvements etc etc   Have led Oracle ERP Production support for a large enterprise clients for over 5+ years. Can we either from Oracle EBS functional or technical stream, Techno-functional is preferred   Also handled other custom apps build on JAVA / Angular and out of the box solutions like SFDC prod support plus releases   Willing to work during night shift on a rotation basis   Well versed with SLAs, metrics, stakeholder management, people practices etc   Prior experience in working in night shift is preferred   Should have interacted with the key stakeholders / Sr. leadership team both from IT and business in the recent past (2-3 years before)          What We Are Looking For        Typically requires 12-15 years of related experience with a 4 year degree; or 3 years and an advanced degree; or equivalent work experience.   Coordinates and supervises the daily activities of business or technical support or production team   Sets priorities for the team to ensure task completion; coordinates work activities with other supervisors   Decisions are guided by policies, procedures and business plan; receives guidance and oversight from manager   Typically does not spend more than 20% of time performing the work supervised   Accountable for the results of a large and/or moderately complex support or production operations team including subordinate work leaders   Applies acquired expertise to analyze and solve problems without clear precedent   Provides input on resource planning and policy development   Coaches team members on performance, completes employee performance evaluations and recommends pay actions         RoleTechnical Lead,Industry TypeHardware & Networking,Functional AreaEngineering - Software & QA,Employment TypeFull Time, PermanentRole CategorySoftware DevelopmentEducationUG :Any GraduatePG :Post Graduation Not RequiredKey SkillsApplication supportProduction supportInformation Technology AssociateProduction operationsManagementTechnology solutionsStakeholder managementResource planningInformation technologyTechnical support","['Application support', 'Production support', 'Information Technology Associate', 'Production operations', 'Management', 'Technology solutions', 'Stakeholder management', 'Resource planning', 'Information technology', 'Technical support']","['UG :Any Graduate', 'PG :Post Graduation Not Required']","Industry TypeHardware & Networking,","Functional AreaEngineering - Software & QA,","Employment TypeFull Time, Permanent",Role CategorySoftware Development
BrainScale,"RoleIT Project Manager,",Not Disclosed,5 - 10 years,Pune,"Job description  The ideal candidate is a self-motivated, multi-tasker, and demonstrated team-player and is responsible for planning, directing, and coordinating IT /Cloud projects. The incumbent ensures project objectives are accomplished within the prescribed time frame and funding parameters while adhering to quality standards. The incumbent also prepares or facilitates the preparation of project deliverables and communicates status with stakeholders as appropriate.   ESSENTIAL FUNCTIONS, DUTIES AND RESPONSIBILITIES:     Leads small to large-sized virtual groups of multi-disciplinary teams of highly-talented professionals     Develops and refines project charters/plans specifying goals, strategy, staffing, scheduling, risks, and contingency plans     Leads the execution of tasks as defined in the project plan in order to achieve project goals     Manages project scope, schedule, and budget using appropriate verification techniques     Ensures a common understanding by setting expectations to align team members and stakeholders     Documents detailed requirements, constraints, and assumptions in order to establish project deliverables using requirement-gathering techniques (planning sessions, brainstorming, focus groups, etc)     Measures project performance using appropriate tools and techniques in order to monitor the progress, identify and quantify variances, perform any required corrective actions, and communicate to stakeholders     Documents project risks, assumptions, and constraints using historical data and expert judgment in order to understand project limitations     Implements approved actions and workarounds to mitigate project risk in order to minimize the project impact     Motivates teams using appropriate tools and techniques in order to increase commitment to project objectives     Develops and documents processes and workflow in support of the dynamic needs of the business     Prepares and presents statements of work and proposals for vendors and potential customers     Optimizes processes, tools, metrics, and human capital to enable effective and efficient projects delivery    MINIMUM REQUIRED QUALIFICATIONS:     Bachelor s degree in Computer Science, Business or related field AND     5+ years of experience in Information Technology AND     5+ years of experience as a Project Manager AND     3+ years of experience as a Scrum Master     Strong communication and documentation skills    OTHER REQUIRED EXPERIENCE, KNOWLEDGE, SKILLS ABILITIES:     Successful project tracking and schedule compliance     Ability to work across multiple job levels to achieve results     Proven ability to manage multiple projects simultaneously in a deadline driven environment     Consistent success in leading teams to meet aggressive deadlines     Outstanding time management and organization skills     Demonstrated use of sound and proven project management practices and tools (Microsoft Office / Project / Visual Studio Team Services)     Ability to pass required background checks     Project Management Professional (PMP) and/or Certified Scrum Master a plus     Knowledge of Cloud Technology (Azure, AWS, etc) a plus   RoleIT Project Manager,Industry TypeBPO / Call Centre,Functional AreaProject & Program Management,Employment TypeFull Time, PermanentRole CategoryTechnology / ITEducationUG :Any GraduatePG :Any PostgraduateKey SkillsComputer sciencePMPhuman capitalStaffingWorkflowSchedulingScrumVisual StudioInformation technologyAnalytics","['Computer science', 'PMP', 'human capital', 'Staffing', 'Workflow', 'Scheduling', 'Scrum', 'Visual Studio', 'Information technology', 'Analytics']","['UG :Any Graduate', 'PG :Any Postgraduate']","Industry TypeBPO / Call Centre,","Functional AreaProject & Program Management,","Employment TypeFull Time, Permanent",Role CategoryTechnology / IT
Leading Client,"RoleEnterprise Sales Manager,",Not Disclosed,1 - 2 years,Kolkata,"Job descriptionIntroduction:We are hiring a Sales Manager for our client company which is a leader in the Information Technology industry.Requirements:- Achieve growth and hit sales targets by successfully managing the sales team- Design and implement a strategic business plan that expands company's customer base and ensure it's strong presence- Own recruiting, objectives setting, coaching and performance monitoring of sales representatives- Build and promote strong, long-lasting customer relationships by partnering with them and understanding their needs- Present sales, revenue and expenses reports and realistic forecasts to the management team- Identify emerging markets and market shifts while being fully aware of new products and competition statusQualifications:- One to two years of experience- Degree in business administration or a related field- Committed to continuous education through workshops, seminars and conferences- Demonstrated ability to communicate, present and influence credibly and effectively at all levels of the organization- Proven ability to drive the sales process from plan to close- Strong business sense and industry expertise- Excellent mentoring, coaching and people management skillsRoleEnterprise Sales Manager,Industry TypeManagement Consulting,Functional AreaSales & Business Development,Employment TypeFull Time, PermanentRole CategoryEnterprise & B2B SalesEducationUG :Any GraduatePG :Any PostgraduateDoctorate :Doctorate Not RequiredKey SkillsSalessales managementpeople managementsales processbusiness planningSkills highlighted with ‘‘ are preferred keyskills","['Sales', 'sales management', 'people management', 'sales process', 'business planning']","['UG :Any Graduate', 'PG :Any Postgraduate', 'Doctorate :Doctorate Not Required']","Industry TypeManagement Consulting,","Functional AreaSales & Business Development,","Employment TypeFull Time, Permanent",Role CategoryEnterprise & B2B Sales
"PERSOLKELLY is one of the largest recruitment companies in Asia Pacific providing comprehensive end-to-end workforce solutions to clients. Headquartered in Singapore, the company was established in 2016 and is a joint venture between Kelly Services, Inc. and affiliates of PERSOL HOLDINGS Co. Ltd. Today, PERSOLKELLY operates more than 45 offices across 13 markets including Australia, China, Hong Kong, India, Indonesia, Korea, Malaysia, New Zealand, Philippines, Singapore, Taiwan, Thailand, and Vietnam. For more information, please visit www.persolkelly.com","RoleProduct Head,",Not Disclosed,12 - 16 years,Bangalore/Bengaluru,"Job description  Team Management: The Sr. Director, Product Management will lead a team of 4 individuals and will be responsible for managing individual and team performance, creating a culture of continuous improvement, and ensuring that the team consistently aligns to corporate objectives. This individual will handle performance management, training, coaching, onboarding, and other day-to-day activities, and will be heavily involved in budgeting and strategic planning.        Roadmap & Backlog: The product team is responsible for maintaining roadmaps for each product, translating those roadmap items into epics and stories, and ensuring that those stories are properly groomed and accepted by our engineering teams. The Sr. Director will ensure that both the roadmap and backlog are updated frequently and provide a clear vision for the direction of a grouping of products that aligns to broader corporate strategy, technology roadmap, and product vision. They’ll provide frequent updates and reporting on roadmap contents and progress, as well as the decision-making process that goes into defining the Roadmap.   Process & Project Coordination: The Sr. Director, Product Management will work closely with other teams, including UX/UI Design, Engineering, Tech Ops, Support, and Marketing to ensure that all projects function smoothly. Where necessary, the Manager will work to create and implement policies, procedures, and processes in order to improve our workflow and output. This role also includes internal collaboration with other leaders inside of the Product team, including VPs, Product Directors, Managers, and Product Managers.   Customer Feedback: The Sr. Director will construct and oversee a formal customer-feedback process designed to survey clients, collect relevant data, and use that as part of the design process. This process will also include working closely with Customer Success and our Services teams to identify at-risk clients and better understand the client lifecycle.     Leadership: Product Management is a difficult role, with immense responsibility, competing demands, and the constant pressure of making difficult decisions. The Sr. Director will provide steady leadership, mentoring, and support for the product team with the goal of ensuring that morale and productivity remain high. This role should also take special care that individual product managers and possibly product directors are adequately supported and mentored. Leadership includes bringing product management best practices to the team.       RoleProduct Head,Industry TypeRecruitment / Staffing,Functional AreaProduct Management,Employment TypeFull Time, PermanentRole CategoryProduct Management - TechnologyEducationUG :Any GraduatePG :Any PostgraduateKey SkillsProduct managementTeam managementManager Information TechnologyPerformance managementStrategic planningDirectorWorkflowProduct designBudgetingContinuous improvement","['Product management', 'Team management', 'Manager Information Technology', 'Performance management', 'Strategic planning', 'Director', 'Workflow', 'Product design', 'Budgeting', 'Continuous improvement']","['UG :Any Graduate', 'PG :Any Postgraduate']","Industry TypeRecruitment / Staffing,","Functional AreaProduct Management,","Employment TypeFull Time, Permanent",Role CategoryProduct Management - Technology
"For four decades, State Street Global Advisors has served the worlds governments, institutions and financial advisors. With a rigorous, risk-aware approach built on research, analysis and market-tested experience, we buildfrom a breadth of active and index strategies to create cost-effective solutions. As stewards, we help portfolio companies see that what is fair for people and sustainable for the planet can deliver long-term performance. And, as pioneers in index, ETF, and ESG investing, we are always inventing new ways to invest. As a result, we have become the worlds third-largest asset manager with US $3.05 trillionunder our care.","RoleOther,",Not Disclosed,2 - 3 years,Bangalore/Bengaluru,"Job description   Who we are looking for     We are looking for a candidate with experience in creating and delivering business process mapping for a large financial institution with understanding of the complexities of a global organization.     What you will be responsible for     Reporting to the GD Head of BPM management team, the candidate will be responsible for creating and maintaining business process maps to support the global delivery organization, driving the usage of the process maps as a key management tool during business as usual activities. Business Process Mapping will include mapping key data such as risk and controls, IT applications, locations and ensuring that the same taxonomies are being used linking the process maps to operating procedures, the control inventory as well as other enterprise -wide initiatives.       What we value     These skills will help you succeed in this role     Experience in financial services    Experience in delivering large projects/initiatives    Experience in managing a process mapping team      Education & Preferred Qualifications      A minimum of a bachelor s degree in information technology/Management or Business is required.    A minimum of 2+ years experience.    RoleOther,Industry TypeBanking,Functional AreaOther,Employment TypeFull Time, PermanentRole CategoryOtherEducationUG :Any GraduatePG :Any PostgraduateKey SkillsProcess mappingUsageHead Business DevelopmentBusiness process mappingInformation technology managementKey managementManagementFinancial servicesInventoryBpm","['Process mapping', 'Usage', 'Head Business Development', 'Business process mapping', 'Information technology management', 'Key management', 'Management', 'Financial services', 'Inventory', 'Bpm']","['UG :Any Graduate', 'PG :Any Postgraduate']","Industry TypeBanking,","Functional AreaOther,","Employment TypeFull Time, Permanent",Role CategoryOther
"For four decades, State Street Global Advisors has served the worlds governments, institutions and financial advisors. With a rigorous, risk-aware approach built on research, analysis and market-tested experience, we buildfrom a breadth of active and inde","RoleOther Consulting - Other,",Not Disclosed,2 - 4 years,Bangalore/Bengaluru,"Job description   Who we are looking for    We are looking for a candidate with experience in creating and delivering business process mapping for a a large financial institution with understanding of the complexities of a global organization.    What you will be responsible for    Reporting to the GD Head of BPM management team, the candidate will be responsible for creating and maintaining business process maps to support the global delivery organization, driving the usage of the process maps as a key management tool during business as usual activities. Business Process Mapping will include mapping key data such as risk and controls, IT applications, locations and ensuring that the same taxonomies are being used linking the process maps to operating procedures, the control inventory as well as other enterprise -wide initiatives.      What we value    These skills will help you succeed in this role    Experience in financial services   Experience in delivering large projects/initiatives   Experience in managing a process mapping team     Education Preferred Qualifications     A minimum of a bachelor s degree in information technology/Management or Business is required.    A minimum of 4+ years experience.   RoleOther Consulting - Other,Industry TypeBanking,Functional AreaConsulting,Employment TypeFull Time, PermanentRole CategoryOther ConsultingEducationUG :Any GraduatePG :Any PostgraduateKey SkillsProcess mappingInvestment researchProduct innovationManager TechnologyBusiness process mappingInformation technology managementData analyticsInvestment managementKey managementFinancial services","['Process mapping', 'Investment research', 'Product innovation', 'Manager Technology', 'Business process mapping', 'Information technology management', 'Data analytics', 'Investment management', 'Key management', 'Financial services']","['UG :Any Graduate', 'PG :Any Postgraduate']","Industry TypeBanking,","Functional AreaConsulting,","Employment TypeFull Time, Permanent",Role CategoryOther Consulting
Talentica Software is an innovative product development company that helps startups build their own products. We help technology companies transform their ideas into successful products by partnering in their roadmap from pre-funded startups to a profitable acquisition.,"RoleEngineering Manager,",Not Disclosed,11 - 15 years,Bangalore/Bengaluru,"Job description  Strive to transform customer ideas into successful products.   Solve critical business problems by using latest tools and technologies or innovative architecture/solution.   Head multiple dedicated engineering product teams and develop the core product for customers.   Lead high performing product-development teams.     Must-Have Technical Skills     Thorough experience (11-15 years) of designing, developing, and testing applications.   Spent at least last 5 years working in Java, Spring MVC/Boot, Bigdata (Spark , Hive, Strom, etc) Rest, RDBMS database design, SQL Programming, Cloud working knowledge (any), Scalable design, and Linux ecosystem.   Understands software development process using Agile Scrum/Scrumban methodology and tools like Jira, and can also set it up for his/her teams.   Understands the DevOps and CI/CD processes from code development to release and comfortable in setting it up for teams.   Managed single or multiple teams with 15+ overall team members directly or indirectly.   Excellent oral and written communication skills.     Nice to Have Technical Skills     Micro Services, Service Bus/Queues, CI/CD.   One of the frontend frameworks at intermediate level.   Knowledge of NoSQL databases.     Education Qualification     BE/B.Tech from IIT, NIT, BITS Pilani, COEP (Pune), VJTI, IIT-BHU or ISM and selected few other colleges.     You will love this job if you are     A hands on engineer with experience of the latest technologies/paradigms.   A technologist who loves to see the product in the hands of the customers at a true startup pace.   A product-thinker who ll think through all the complexities and work hard for customer success.   A team lead with an exceptional ability to develop and inspire his teams.   A continuous learner who wants to make a difference with innovation.  RoleEngineering Manager,Industry TypeSoftware Product,Functional AreaEngineering - Software & QA,Employment TypeFull Time, PermanentRole CategorySoftware DevelopmentEducationUG :B.Tech/B.E. in Any Specialization, Any GraduatePG :Any PostgraduateKey SkillsNoSQLLinuxRDBMSDatabase designInformation technology managementJIRAInformation technologyPetroleumSQL","['NoSQL', 'Linux', 'RDBMS', 'Database design', 'Information technology management', 'JIRA', 'Information technology', 'Petroleum', 'SQL']","['UG :B.Tech/B.E. in Any Specialization, Any Graduate', 'PG :Any Postgraduate']","Industry TypeSoftware Product,","Functional AreaEngineering - Software & QA,","Employment TypeFull Time, Permanent",Role CategorySoftware Development
"PhonePe is a mobile payments app that allows you to transfer money instantly to anyone, by using just their mobile number. Our goal is to make digital payments so easy, safe universally accepted that people never feel the need to carry cash or cards again.","RoleOther,",Not Disclosed,2 - 5 years,Bangalore/Bengaluru,"Job description          Perform internal audits and process reviews for functions to assess the adequacy, effectiveness and efficiency of the established internal controls and procedures   Lead and perform control design assessments; Lead walkthroughs, identifying controls in the processes/ functions/ products/services, etc.   Identify key areas of risk within processes and propose appropriate controls with the objective of mitigating the risks and increasing efficiency   Responsible for operational testing of the controls (test scripts), including validation procedures.   Evaluate the testing scripts on a regular basis to ensure changes are incorporated   Evaluate the corrective action plans received from reviewee for appropriateness and/or Sufficiency. Collaborate with relevant functions to ensure timely closure of corrective action plans.   Report on status of implementation of management action plans   Work with 2nd line of defence Compliance functions to align audit activity   Demonstrate skills to lead auditors, remain flexible, prioritize and maintain a strong attention to detail in a fast-paced environment.   Strong collaboration and project management skills to complete quality work on the time with budgeted resources.     Essential Skills & Qualification      Bachelor s degree with focus on Information Systems required   Sound understanding of control environment, compliance and risk frameworks such as CoBIT; COSO; ISO standards, etc.   Minimum 6 years of experience in relevant field   Working knowledge and experience in SOX programs / IT systems/ General Computer controls / Cybersecurity. Etc   Experience in performing Technology Audits / IT Operations reviews / Integrated Audits   Effective Verbal and Written Communication Skills   Be able to work in a fast-paced role with competing priorities. Adaptable to project requirements and does what is required to get the job done   Demonstrate ability for seamless execution, continuous improvement and problem solving     Preferred Skills & Qualification      Experience in BFSI / FinTech companies   Experience integrating data analytics in audits   CISA / CIA / CFE related certification   Big 4 experience      RoleOther,Industry TypeFinTech / Payments,Functional AreaOther,Employment TypeFull Time, PermanentRole CategoryOtherEducationUG :Any GraduatePG :Any PostgraduateKey SkillsISOCisaBfsiWellnessMedical insuranceIT operationsContinuous improvementOperationsFinancial servicesAuditing","['ISO', 'Cisa', 'Bfsi', 'Wellness', 'Medical insurance', 'IT operations', 'Continuous improvement', 'Operations', 'Financial services', 'Auditing']","['UG :Any Graduate', 'PG :Any Postgraduate']","Industry TypeFinTech / Payments,","Functional AreaOther,","Employment TypeFull Time, Permanent",Role CategoryOther
