company,role,salary,experience,Location,description,skills,qualification,industry_type,Functional_area,Employment_type,Role_category
 Leading provider of simplified RFID integrated solutions. Our applications are designed to optimize business process by streamlining and automating recurring tasks. We pride ourselves in understanding customer requirements and the ability to develop specific solutions that can generate an expeditious ROI for our clients. ,"RoleSoftware Developer in Test (SDET),","₹ 4,75,000 - 9,50,000 P.A. ",3 - 5 years,Bangalore/Bengaluru,"Job description Job descriptionStrong understanding of object-oriented programmingFamiliar with various design and architectural patternsKnowledge in basic engineering concepts like Data Structure and Algorithms.Proficiency in C#, SQL, MVC, .Net and ASP.NET, .Net Core and ASP.Net Core, REST Full, web APIs Web forms, WCF, REST, Entity Framework.Knowledge of front-end languages (HTML, CSS, JavaScript, jQuery) and Angular framework.Strong knowledge in MS SQL server databaseWriting clean, readable, and easily maintainable codeUnderstanding of fundamental design principles for building a scalable applicationRoleSoftware Developer in Test (SDET),Industry TypeSoftware Product,Functional AreaEngineering - Software & QA,Employment TypeFull Time, PermanentRole CategoryQuality Assurance and TestingEducationUG :Any GraduatePG :Any PostgraduateDoctorate :Any DoctorateKey SkillsWeb Developmentc#CSSWeb ApiAspnet Web ServicesFull Stack Application DevelopmentAsp.Net Web ApiHTMLfull stack web developerAngularWpf Applicationsweb developerASP.NetAsp.Net CoreBootstrapMVCAngular Web DevelopmentMs Sql DatabaseSkills highlighted with ‘‘ are preferred keyskills","['Web Development', 'c#', 'CSS', 'Web Api', 'Aspnet Web Services', 'Full Stack Application Development', 'Asp.Net Web Api', 'HTML', 'full stack web developer', 'Angular', 'Wpf Applications', 'web developer', 'ASP.Net', 'Asp.Net Core', 'Bootstrap', 'MVC', 'Angular Web Development', 'Ms Sql Database']","['UG :Any Graduate', 'PG :Any Postgraduate', 'Doctorate :Any Doctorate']","Industry TypeSoftware Product,","Functional AreaEngineering - Software & QA,","Employment TypeFull Time, Permanent",Role CategoryQuality Assurance and Testing
"Vymo is a personal assistant app for enterprise sales / service teams. It predicts what a rep / manager should do next, detects whether this has happened and links this to downstream metrics to drive better predictions. Vymo has helped some of the worlds largest enterprise field teams get almost 2X productivity uplift; resulting in 30-50% higher sales within 3 months of launch.","RoleDigital Marketing - Other,",Not Disclosed,4 - 5 years,Bangalore/Bengaluru,"Job description       Primary Responsibilities       Directly conducts or manages all website development and programming in Wordpress   Integrates Wordpress based content pages with third party integration, e.g., Facebook, LinkedIn   Ensures website uptime, functionality and security   Manages vendors including hosting providers, contractors, and translation service   Works with vendors to ensure functionality, monitor links/issues, ensure forms are always working   Addresses bugs/performance issues with websites to maintain functionality   Manages all site programming and administration for Wordpress based content pages   Keeps website current at all times   Plans for future website enhancements / upgrades / functionality e.g. assess and implement automation tools   Conducts marketing automation activities, focusing on turning web traffic and responses from marketing activities into revenue   Programming website tracking, generating emails, constructing forms   Integrating marketing automation tools with corporate CRM   Recommending new tools and processes to enhance marketing productivity   Documenting existing processes and implementing improvements to enhance marketing productivity   Collaborate closely with marketing team colleagues to implement marketing best practices:   Creates/modifies settings and appearances of website as needed   Examines and analyzes site traffic (statistics, trends, insights, evaluations, etc)   Assists marketing in modifying and improving online customer acquisition   Drives improved SEO   Helps with website tracking, generating HTML emails, and constructing forms   Documents existing processes and implementing improvements to enhance marketing productivity   Keep senior management informed by:   Advises Manager of any current or foreseen issues   Provides marketing reports on an as-needed basis   Automates metrics and reporting processes   Identify and fix all the technical issues in the Google Search Console assist marketing team in technical seo.   Knowledge of Marketing automation tools like Hubspot, Mailchimp, Google analytics, Google Tag manager and Zapier is a plus.    Proficient in HTML/CSS, and client-side scripting libraries.   RoleDigital Marketing - Other,Industry TypeIT Services & Consulting,Functional AreaMarketing & Communication,Employment TypeFull Time, PermanentRole CategoryDigital MarketingEducationUG :Any GraduatePG :Any PostgraduateKey SkillsCustomer acquisitionGoogle AnalyticsmanagementWordpressAutomation toolsProgrammingHTMLSEOCRMmarketing automation","['Customer acquisition', 'Google Analytics', 'management', 'Wordpress', 'Automation tools', 'Programming', 'HTML', 'SEO', 'CRM', 'marketing automation']","['UG :Any Graduate', 'PG :Any Postgraduate']","Industry TypeIT Services & Consulting,","Functional AreaMarketing & Communication,","Employment TypeFull Time, Permanent",Role CategoryDigital Marketing
"Axcend is a CSIA certified organization operating in the Industrial Automation, Manufacturing IT, DIgital Manufacturing and IIOT space. For past 18+ years, we have been partnering with major customers globally, adding significant value in the delivery of projects across various industry verticals - successfully executed 400+ projects in Food & Beverages, Consumer Packaged Goods, Automotive, Pharma & Utilities (Energy, Gas & Water) with operational presence in Bangalore, Pune & US.","RoleBack End Developer,",Not Disclosed,6 - 11 years,Bangalore/Bengaluru,"Job description  This is an opportunity to work onsite at our customer s location at Schneider-Electric, Bangalore.    Professional experience of 6+ years in development of front applications by using latest web technologies and web APIs and 3+ years experience Angular web platform.  Technical Skill Set:    Strong experience of in HTML5, CSS and LESS, Java script (js) , Type script (ts), REST API, RDMS, XML, JSON and different parsing libraries, HTTP and HTTPS communications   Experience on Security and Secure Design Practices   Experience on OS like Windows Server or Linux   RoleBack End Developer,Industry TypeIT Services & Consulting,Functional AreaEngineering - Software & QA,Employment TypeFull Time, PermanentRole CategorySoftware DevelopmentEducationUG :Any GraduatePG :Post Graduation Not RequiredKey SkillsCSSPDFWeb technologiesLinuxhtml5XMLJavascriptHTTPJSONWindows","['CSS', 'PDF', 'Web technologies', 'Linux', 'html5', 'XML', 'Javascript', 'HTTP', 'JSON', 'Windows']","['UG :Any Graduate', 'PG :Post Graduation Not Required']","Industry TypeIT Services & Consulting,","Functional AreaEngineering - Software & QA,","Employment TypeFull Time, Permanent",Role CategorySoftware Development
"ITC Infotech is a leading global technology services and solutions provider, led by Business and Technology Consulting. ITC Infotech provides business-friendly solutions to help clients succeed and be future-ready, by seamlessly bringing together digital expertise, strong industry specific alliances and the unique ability to leverage deep domain expertise from ITC Group businesses. The company provides technology solutions and services to enterprises across industries such as Banking & Financial Services, Healthcare, Manufacturing, Consumer Goods, Travel and Hospitality, through a combination of traditional and newer business models, as a long-term sustainable partner.","RoleSoftware Development - Other,",Not Disclosed,3 - 6 years,Bangalore/Bengaluru,"Job description Java scripting,   Service Now Service Catalog  SNOW integration to 3rd party tools ( REST, SOAP )  Work flow design  Flow Designer RoleSoftware Development - Other,Industry TypeIT Services & Consulting,Functional AreaEngineering - Software & QA,Employment TypeFull Time, PermanentRole CategorySoftware DevelopmentEducationUG :Any GraduatePG :Any PostgraduateKey SkillsJavaWeb technologiesWorkflowservice catalogSOAP","['Java', 'Web technologies', 'Workflow', 'service catalog', 'SOAP']","['UG :Any Graduate', 'PG :Any Postgraduate']","Industry TypeIT Services & Consulting,","Functional AreaEngineering - Software & QA,","Employment TypeFull Time, Permanent",Role CategorySoftware Development
US MNC,"RoleFull Stack Developer,","₹ 50,00,000 - 90,00,000 P.A. ",6 - 11 years,Bangalore/Bengaluru,"Job descriptionBuild robust Javascript-driven web applications Leverage different tools and strategies to help identify opportunities for site optimization Update and maintain backend codebases for our content management systems Work closely with product and program management to help prioritize items in the development roadmap Articulate technical requirements, write functional specs and set standards for site performance Perform collaboration duties such as code reviews and technical documentation for peers. A minimum of 5 years of hands-on Javascript development experience (backend NodeJS & frontend) Hands-on experience with site optimization including SEO, in-page performance, technical audits, and Core Web Vitals Expert Linux command line experience Expert knowledge integrating API endpoints Expert knowledge of Git repository workflows using CLI Outstanding communication skills to interact with technology partners, and to provide consistent technical feedback with other developers You are currently in web development with a focus and expertise on Javascript - both backend and frontend You are proficient in industry tools involving site performance, SEO and analytics You have a deep understanding of core Javascript disciplines You have a knack for finding solutions to problems - and using a full arsenal of debugging tools You have built your own custom tools to help you automate tasks You have experience with at least another backend programming language (e.g. Python, PHP) You never stop learning about web technology; never stopping at what you know, and always keeping up with the latest in all aspects of site development, performance and optimizationRoleFull Stack Developer,Industry TypeInternet,Functional AreaEngineering - Software & QA,Employment TypeFull Time, PermanentRole CategorySoftware DevelopmentEducationUG :B.Tech/B.E. in ComputersKey SkillsCLILinuxAPIJavascriptPHPNode.JsPythonWeb Applications DeveloperSkills highlighted with ‘‘ are preferred keyskills","['CLI', 'Linux', 'API', 'Javascript', 'PHP', 'Node.Js', 'Python', 'Web Applications Developer']",['UG :B.Tech/B.E. in Computers'],"Industry TypeInternet,","Functional AreaEngineering - Software & QA,","Employment TypeFull Time, Permanent",Role CategorySoftware Development
" About Karkinos Healthcare Pvt. Ltd. :Karkinos Healthcare Pvt Ltd (KH), founded in July 2020, is an oncology focused, digital healthcare platform. Our mission is to ensure no person is deprived of quality care either by lack of access or affordability. KH has been founded by Mr. R Venkataramanan, former Managing Trustee of the Tata Trusts (ex board member of Tata Memorial Hospital, Tata Medical Centre Trust; Tata Centres for cancer care). A strong clinician team is led by Dr Moni Abraham K. (ex Narayana Health, visiting professor Roswell Park Cancer Institute, NYU) and Dr. R. Sankaranarayanan (former Chief of Cancer Screening Group, Early Detection & Prevention Section and Special Advisor on Cancer Control at the International Agency for Research on Cancer in Lyon, France).  Karkinos is backed by the Tata Group, Reliance Group and Rakuten Medical, a global leader in oncology care. Karkinos is proud to collaborate with Tata Memorial Hospital, and UK's Guys and St Thomas NHS Foundation Trust to ensure we are at the frontier of oncology treatment and care.  To know more about us, visit our website : http://www.karkinos.in","RoleSoftware Development - Other,",Not Disclosed,3 - 8 years,Bangalore/Bengaluru( Bellandur ),"Job description About Karkinos Healthcare Pvt. Ltd. :Karkinos Healthcare Pvt Ltd (KH), founded in July 2020, is an oncology focused, digital healthcare platform. Our mission is to ensure no person is deprived of quality care either by lack of access or affordability. KH has been founded by Mr. R Venkataramanan, former Managing Trustee of the Tata Trusts (ex board member of Tata Memorial Hospital, Tata Medical Centre Trust; Tata Centres for cancer care). A strong clinician team is led by Dr Moni Abraham K. (ex Narayana Health, visiting professor Roswell Park Cancer Institute, NYU) and Dr. R. Sankaranarayanan (former Chief of Cancer Screening Group, Early Detection & Prevention Section and Special Advisor on Cancer Control at the International Agency for Research on Cancer in Lyon, France).Karkinos is backed by the Tata Group, Reliance Group and Rakuten Medical, a global leader in oncology care. Karkinos is proud to collaborate with Tata Memorial Hospital, and UK's Guys and St Thomas NHS Foundation Trust to ensure we are at the frontier of oncology treatment and care.To know more about us, visit our website : http://www.karkinos.inRoles and Responsibility :- Looking for 4+ years experience web developer- Will be independently responsible for developing and managing multiple responsive web applications using php, MySQL.- Strong experience in code igniter framework needed- Must have solid experience in jquery/css/html- Should be able to convert designs to html/css/Javascript and then complete the backend development using php and mysql.- Should have good knowledge of database concepts and worked on any of mysql/postgress/mongodb- Understand gitlab and CI/CD practices.We are looking for people with experience in the following :- String core PHP Hands on experience.- Strong Expertise in CodeIgniter Framework.- Good Knowledge of PHP5+, MySQL, jQuery, Javascript, HTML5, CSS3, XML.- Sound knowledge of database designing and application architecture planning for Core PHP projects.- Good debugging skills.- Expertise in PHP, MVC Frameworks and good technology exposure of Codeigniter.- Assure that all user input is validated before submitting to back-end.- Good understanding of asynchronous request handling, partial page updates, and AJAX will be preferred.Education and Experience :- Bachelor's or Master's engineering degree- 4+ years experience. RoleSoftware Development - Other,Industry TypeMedical Services / Hospital,Functional AreaEngineering - Software & QA,Employment TypeFull Time, PermanentRole CategorySoftware DevelopmentEducationUG :B.Tech/B.E. in ComputersPG :M.Tech in ComputersKey SkillsPHPWeb DevelopmentCodeigniterAjaxCss/Css3MVC FrameworkJavascripthtmljquerySkills highlighted with ‘‘ are preferred keyskills","['PHP', 'Web Development', 'Codeigniter', 'Ajax', 'Css/Css3', 'MVC Framework', 'Javascript', 'html', 'jquery']","['UG :B.Tech/B.E. in Computers', 'PG :M.Tech in Computers']","Industry TypeMedical Services / Hospital,","Functional AreaEngineering - Software & QA,","Employment TypeFull Time, Permanent",Role CategorySoftware Development
Login Systems,"RoleBack End Developer,",Not Disclosed,3 - 8 years,Coimbatore,"Job descriptionDesign,  develop,  and deploy new database- driven web applications. Lead teams to assist in enforcement of deadlines and schedules.

Required Skills: 

Web site development experience using PHP,  HTML,  Javascript MySQL Preferred skills: Apache,  Linux,  AJAX.

Minimum 3 year in open source web development with experience in handling reputed projects.RoleBack End Developer,Industry TypeIT Services & Consulting,Functional AreaEngineering - Software & QA,Employment TypeFull Time, PermanentRole CategorySoftware DevelopmentEducationUG :Any GraduatePG :Any PostgraduateKey SkillsdevelopmentWeb developmentDeploymentApachejavascriptHTML;JavascriptLinuxwebMySQLDatabasePHPOpen sourceAjax","['development', 'Web development', 'Deployment', 'Apache', 'javascript', 'HTML;Javascript', 'Linux', 'web', 'MySQL', 'Database', 'PHP', 'Open source', 'Ajax']","['UG :Any Graduate', 'PG :Any Postgraduate']","Industry TypeIT Services & Consulting,","Functional AreaEngineering - Software & QA,","Employment TypeFull Time, Permanent",Role CategorySoftware Development
Login Systems,"RoleBack End Developer,",Not Disclosed,2 - 5 years,Bengaluru,"Job descriptionJob Desciption:  Design,  develop,  and deploy new database- driven web applications. Lead teams to assist in enforcement of deadlines and schedules.Required Skills:  Web site development experience using PHP,  HTML,  Javascript MySQL Preferred skills:  Apache,  Linux,  AJAX.Experience:  Minimum 3 year in open source web development with experience in handling reputed projects.RoleBack End Developer,Industry TypeFilm / Music / Entertainment,Functional AreaEngineering - Software & QA,Employment TypeFull Time, PermanentRole CategorySoftware DevelopmentEducationUG :B.Tech/B.E. in ComputersPG :M.Tech in ComputersKey Skillsapachelinglinuxhphphtmlmysqlweb developmentajaxjavascript","['apache', 'ling', 'linux', 'h', 'php', 'html', 'mysql', 'web development', 'ajax', 'javascript']","['UG :B.Tech/B.E. in Computers', 'PG :M.Tech in Computers']","Industry TypeFilm / Music / Entertainment,","Functional AreaEngineering - Software & QA,","Employment TypeFull Time, Permanent",Role CategorySoftware Development
Login Systems,"RoleBack End Developer,",Not Disclosed,3 - 8 years,Bengaluru,"Job description  Job DescriptionDesign,  develop,  and deploy new database-driven web applications. Lead teams to assist in enforcement of deadlines and schedules. Required Skills: Web site development experience using PHP,  HTML,  Javascript MySQL Preferred skills: Apache,  Linux,  AJAX. Experience: Minimum 3 year in open source web development with experience in handling reputed projects. RoleBack End Developer,Industry TypeFilm / Music / Entertainment,Functional AreaEngineering - Software & QA,Employment TypeFull Time, PermanentRole CategorySoftware DevelopmentEducationUG :B.Tech/B.E. in ComputersPG :M.Tech in ComputersKey Skillsopen sourceapachelinuxphphtmlmysqlweb developmenthandlingajaxjavascript","['open source', 'apache', 'linux', 'php', 'html', 'mysql', 'web development', 'handling', 'ajax', 'javascript']","['UG :B.Tech/B.E. in Computers', 'PG :M.Tech in Computers']","Industry TypeFilm / Music / Entertainment,","Functional AreaEngineering - Software & QA,","Employment TypeFull Time, Permanent",Role CategorySoftware Development
"Zscaler enables the worlds leading organizations to securely transform their networks and applications for a mobile and cloud first world. Its flagship services, Zscaler Internet Access and Zscaler Private Access, create fast, secure connections between users and applications, regardless of device, location, or network. Zscaler services are 100% cloud-delivered and offer the simplicity, enhanced security, and improved user experience that traditional appliances or hybrid solutions are unable to match. Used in more than 185 countries, Zscaler operates the worlds largest cloud security platform, protecting thousands of enterprises and government agencies from cyberattacks and data loss.","RoleFull Stack Developer,",Not Disclosed,2 - 6 years,Bangalore/Bengaluru,"Job description  The Sr Web Developer is part of Zscaler s marketing Operations team with a specific focus on supporting Web development.    This role will significantly impact both Marketing ops and the broader company. This position will directly interact with Demand Gen, Field Marketing, and Marketing operation peers. The primary responsibilities of this role will include:     To configure, test and launch solutions within AWS, GCP      Comfortable working with the command line within a LAMP stack environment (Linux, Apache, MySQL/MariaDB, and PHP)      EC2, Lambada, S3, DNS configuration, setup and maintenance.      Planning and administration of XMMP server infrastructure, setup, scaling, updating.      Monitoring, issues debug and analysis, fixing.      Develop integrations between core business systems using both code and no-/low-code platforms, and support those integrations once deployed      Maintain security, backup, and redundancy strategies      Plan and implement systems automation as required for better efficiency and to lower the need for human intervention      Monitor and test application performance to detect potential bottlenecks, identify possible solutions and work with internal security team to implement these fixes.      Maintain security, backup and redundancy strategies.      Participate in the design of information and operational support systems.     Qualifications      Strong background in HTML, MySQL, JavaScript, query, CSS, Bootstrap, REST APIs, and Git      Proficiency in delivering high-quality PHP code making use of test-driven methodologies and modern frameworks      Experience in integrating with REST APIs and handle dynamic data on frontend      Creating and maintaining technical documentation      Good knowledge of application data security.      Good knowledge of versioning with Git and continuous integration tools processes.      Good knowledge of system / application performance monitoring.      Familiar with Bash scripting       RoleFull Stack Developer,Industry TypeHardware & Networking,Functional AreaEngineering - Software & QA,Employment TypeFull Time, PermanentRole CategorySoftware DevelopmentEducationUG :Any GraduatePG :Any PostgraduateKey SkillsAutomationGITLinuxMySQLWeb developmentJavascriptPHPHTMLApacheTechnical documentation","['Automation', 'GIT', 'Linux', 'MySQL', 'Web development', 'Javascript', 'PHP', 'HTML', 'Apache', 'Technical documentation']","['UG :Any Graduate', 'PG :Any Postgraduate']","Industry TypeHardware & Networking,","Functional AreaEngineering - Software & QA,","Employment TypeFull Time, Permanent",Role CategorySoftware Development
