company,role,salary,experience,Location,description,skills,qualification,industry_type,Functional_area,Employment_type,Role_category
"Zscaler enables the worlds leading organizations to securely transform their networks and applications for a mobile and cloud first world. Its flagship services, Zscaler Internet Access and Zscaler Private Access, create fast, secure connections between users and applications, regardless of device, location, or network. Zscaler services are 100% cloud-delivered and offer the simplicity, enhanced security, and improved user experience that traditional appliances or hybrid solutions are unable to match. Used in more than 185 countries, Zscaler operates the worlds largest cloud security platform, protecting thousands of enterprises and government agencies from cyberattacks and data loss.","RoleNetwork (Support) Engineer,",Not Disclosed,6 - 8 years,Bangalore/Bengaluru,"Job description   Operational duties for our cloud based products - deployments, on-call, incident management.     Management of container-based architecture (AWS EKS and Kubernetes).     Maintain and improve the existing observability pipeline and operational workflows.     Architect and implement various cloud management automations.     Write and maintain Ops documentation.     Resolve escalations and help prevent reiteration of incidents with process, monitoring and reliability improvements.     Contribute and implement DevOps best practices within the group.     Work as a member of a cross-functional project team contributing to the technology-based solutions and consult on concept feasibility.     Flexible with working in Europe time zone      Qualifications     Minimum of 6 years of relevant experience in designing, analyzing, and troubleshooting distributed systems     Minimum of 3 years experience as software engineer (full stack preferred) JS, Python, Golang     Hands on experience with infrastructure as code     Knowledge of Virtualization, Cloud Architecture and Services, Automated Deployments     Familiarity with web security and protocols HTTP, SSL/TLS, DNS, SQL and networking fundamentals - Rich DevOps skills across CI/CD, SCM, Builds and Releases     Experience with writing technical documents (internal and public)   RoleNetwork (Support) Engineer,Industry TypeHardware & Networking,Functional AreaEngineering - Hardware & Networks,Employment TypeFull Time, PermanentRole CategoryIT NetworkEducationUG :Any GraduatePG :Any PostgraduateKey SkillsNetworkingDNSIncident managementHTTPTroubleshootingSCMVirtualizationSSLSQLPython","['Networking', 'DNS', 'Incident management', 'HTTP', 'Troubleshooting', 'SCM', 'Virtualization', 'SSL', 'SQL', 'Python']","['UG :Any Graduate', 'PG :Any Postgraduate']","Industry TypeHardware & Networking,","Functional AreaEngineering - Hardware & Networks,","Employment TypeFull Time, Permanent",Role CategoryIT Network
"Zscaler enables the worlds leading organizations to securely transform their networks and applications for a mobile and cloud first world. Its flagship services, Zscaler Internet Access and Zscaler Private Access, create fast, secure connections between users and applications, regardless of device, location, or network. Zscaler services are 100% cloud-delivered and offer the simplicity, enhanced security, and improved user experience that traditional appliances or hybrid solutions are unable to match. Used in more than 185 countries, Zscaler operates the worlds largest cloud security platform, protecting thousands of enterprises and government agencies from cyberattacks and data loss.","RoleNetwork (Support) Engineer,",Not Disclosed,6 - 11 years,Bangalore/Bengaluru,"Job description   Operational duties for our cloud based products - deployments, on-call, incident management.     Management of container-based architecture (AWS EKS and Kubernetes).     Maintain and improve the existing observability pipeline and operational workflows.     Architect and implement various cloud management automations.     Write and maintain Ops documentation.     Resolve escalations and help prevent reiteration of incidents with process, monitoring and reliability improvements.     Contribute and implement DevOps best practices within the group.     Work as a member of a cross-functional project team contributing to the technology-based solutions and consult on concept feasibility.     Flexible with working in Europe time zone    Qualifications     Minimum of 6 years of relevant experience in designing, analyzing, and troubleshooting distributed systems     Minimum of 3 years experience as software engineer (full stack preferred) JS, Python, Golang     Hands on experience with infrastructure as code     Knowledge of Virtualization, Cloud Architecture and Services, Automated Deployments     Familiarity with web security and protocols HTTP, SSL/TLS, DNS, SQL and networking fundamentals - Rich DevOps skills across CI/CD, SCM, Builds and Releases     Experience with writing technical documents (internal and public)   RoleNetwork (Support) Engineer,Industry TypeHardware & Networking,Functional AreaEngineering - Hardware & Networks,Employment TypeFull Time, PermanentRole CategoryIT NetworkEducationUG :Any GraduatePG :Any PostgraduateKey SkillsNetworkingDNSIncident managementHTTPTroubleshootingSCMVirtualizationSSLSQLPython","['Networking', 'DNS', 'Incident management', 'HTTP', 'Troubleshooting', 'SCM', 'Virtualization', 'SSL', 'SQL', 'Python']","['UG :Any Graduate', 'PG :Any Postgraduate']","Industry TypeHardware & Networking,","Functional AreaEngineering - Hardware & Networks,","Employment TypeFull Time, Permanent",Role CategoryIT Network
"Data is powering the worlds leading innovations from autonomous vehicles to AI-powered neural networks. At Informatica, we call this Data 4.0when next-generation intelligent enterprises leverage data to make possible what never existed before.Informatica is the only proven Enterprise Cloud Data Management leader that accelerates data-driven digital transformation. Todays intelligent enterprise is fueled by data and that data must be properly managed, governed, protected, and utilized this is where Informatica drives next-generation innovation with its Intelligent Data Platform. Our Intelligent Data Platform, a complete and modular solution built on a microservices architecture and based on the AI-powered, CLAIREengine, enables companies to fuel innovation, become more agile, and realize new growth opportunities, resulting in intelligent market disruptions.","RoleSystem Administrator / Engineer,",Not Disclosed,5 - 9 years,Bangalore/Bengaluru,"Job description    Technology You ll Use not limited to the following:       Docker and Cloud Platforms (AWS, Azure. GCP), Cloud log services (ELK), Cloud application monitoring tools (Elastic APM, AppDynamics)       Jenkins and Spinnaker CI/CD tools       Git version control systems       Kubernetes, AWS EKS, Helm, Istio, Kiali, Service Mesh       Telemetry tools which include Prometheus, ELK       Your Responsibilities       Operate and administer the Informatica Cloud Services (ICS) and infrastructure using Chef/Jenkins, SumoLogic, Panopta, Elastic Search, and monitoring tools       Manage RCA, Incident Process, and Risk Analysis of Informatica Cloud Services       Perform advanced troubleshooting and monitoring of our systems to ensure adequate SLA and capacity requirements.         Scripting experience with Bash, PowerShell, Python       Excellent communication skills (written, verbal, interpersonal)       Ability to work independently with little direct supervision       Education / Experience         Bachelor s/Master s Degree in Computer Science or equivalent experience       Good knowledge of large-scale internet service architecture       Good understanding of Unix and TCP/IP fundamentals.       Strong interpersonal and team communications skills are essential       Ability to rapidly learn new software, frameworks, open-source tools and development languages.       Ability to work under considerable pressure managing multiple tasks and priorities       Good knowledge of MySQL DB schema design and performance tuning tasks is a big plus       Good knowledge across entire SDLC, CI/CD tools, with configuration release management, deployments, and troubleshooting in cloud environments       Good understanding of public clouds such as AWS, Azure, GCP       Hands on experience with CI/CD tools such as Jenkins, bamboo, Spinnaker    RoleSystem Administrator / Engineer,Industry TypeSoftware Product,Functional AreaEngineering - Hardware & Networks,Employment TypeFull Time, PermanentRole CategoryIT NetworkEducationUG :Any GraduatePG :Any PostgraduateKey SkillsUnixPerformance tuningAutomationInformaticaTroubleshootingOpen sourceRelease managementSDLCMonitoringPython","['Unix', 'Performance tuning', 'Automation', 'Informatica', 'Troubleshooting', 'Open source', 'Release management', 'SDLC', 'Monitoring', 'Python']","['UG :Any Graduate', 'PG :Any Postgraduate']","Industry TypeSoftware Product,","Functional AreaEngineering - Hardware & Networks,","Employment TypeFull Time, Permanent",Role CategoryIT Network
"CloudifyOps is a boutique Cloud-DNA technology firm enabling businesses maximise profitability, become more agile and innovative through our comprehensive portfolio of Cloud transformation, DevOps consulting and Managed IT Services. We are driven by passion to deliver extraordinary value for our customers. We assure to deliver reduced TCO, greater IT-business alignment and higher SLA.cloudifyops.com","RoleSite Reliability Engineer,",Not Disclosed,3 - 5 years,Bangalore/Bengaluru,"Job descriptionCloud Platform  AzureExperience : 3yrs  5yrsLocation: BangalorePosition Type : PermanentAt CloudifyOps, we count on our site reliability engineers (SREs) to solve interesting technical challenges by defining, designing, deploying, and troubleshooting key Cloud resilience, security, and performance. The role involves software engineering, systems engineering, automation, network operations, data engineering, and DevOps. You should be comfortable building complex distributed systems involving huge amounts of data - collecting metrics, building data pipelines, and analytics. You will incorporate the ethos of software engineering into large-scale operational problems. Your primary goals are to create highly reliable services, platforms, infrastructure, and ultra-scalable software systems to manage the operations of our services. When not working on operations, you will work on software engineering tasks such as design and development of systems that increase reliability, scalability, and reduce operational overhead through automation. If you value simplicity and scale, work comfortably in a collaborative, and agile environment, and are excited to learn, we would love to talk to you.We are looking for:3+ years in DevOps role with hands-on experience in Ansible, Jenkins, Docker, Kubernetes, and Linux (TCP/IP, DNS, load balancing technologies)Ability to lead and develop/operate large scale distributed services/ applicationsAdvanced knowledge on working with fault-tolerant, highly available, high throughput, distributed, and scalable systemsAdvanced knowledge of working in an operational environment with mission-critical tier one services with associated pager dutyDeep understanding of service metrics and alarms through the development of dashboards, service KPIs, alarming systemsThorough understanding of Linux operating systems, system administration, user management and troubleshootingExperience with Oracle DB, SQL, PL/SQL, Oracle Application Express (APEX)Ability to monitor, SNMP, Syslog, telemetry, REST APIExperience with orchestration and configuration management tools like Terraform, KubernetesExposure to Grafana, Prometheus or other TSDB, Kafka, ElasticSearch, and other distributed platformsProficiency in programming and scripting languages such as Java, Python, Perl, BASHKnowledge of Scrum & Agile MethodologiesHave an enthusiastic, go-for-it attitude, a good team player and the willingness to learn and implement new Cloud technologiesDocument all information so you dont need to learn the same thing twiceSystematic and proactive problem-solving approachStrong communication and collaboration skills, a sense of ownership and driveMust Have Tools : Devops Tool : Azure Devops(Any other CICD Tools like Jenkins, CircleCI, TeamCity should also suffice)Strong in Micro services, Orchestration, Docker & KubernetesAgile Concepts  DSM, Tasking, Sprint Planning, Sprint Review and Acceptance CriteriaMonitoring Tools  Any one of them DataDog, Prometheus, Nagios, Zabbix, Azure Monitoring.DevOps Culture/Life cycle Awareness with Hands -on Experience and ability to adapt with new process being laid out by organisation Job Level ExpectationsTerraform Script Maintenance /Creation and ExecutionBasic Knowledge of PowerShell - AutomationK8s - Building & Maintaining the existing Cluster using Helm Charts.Must be able to make changes to the yaml file when requested with certain configurations.Enabling/Disabling network policies, ports, ingress based on new market on boarding inline with new Helm Chart.Verification/Validation and Comparisons of Helm Charts to highlight/document changes.Introduce/Maintain - AKS Auto scaling based on Market Loads.Version Upgrades - Infra Tools - K8s, Helm, Azure Components etc.Azure Administrator - ensuring the services used in the project are up to date, leading the activity of upgrades, changes in Infra Configuration and on boarding of new users, groups etc. inline+C1 with IAM policyAzure DB Backup Policy - Maintain and Reconfigure as per requestDB performance - Based on monitoring results - suggest probable solutions for fine tuning the configuration.RoleSite Reliability Engineer,Industry TypeIT Services & Consulting,Functional AreaEngineering - Software & QA,Employment TypeFull Time, PermanentRole CategoryDevOpsEducationUG :Any GraduateKey SkillsAks KubernetesMonitoring ToolsTerraformHelm ChartsazurekubernetesDatadogdockerScriptingJenkinsTroubleshooting SkillslinuxAzure DevopsSkills highlighted with ‘‘ are preferred keyskills","['Aks Kubernetes', 'Monitoring Tools', 'Terraform', 'Helm Charts', 'azure', 'kubernetes', 'Datadog', 'docker', 'Scripting', 'Jenkins', 'Troubleshooting Skills', 'linux', 'Azure Devops']",['UG :Any Graduate'],"Industry TypeIT Services & Consulting,","Functional AreaEngineering - Software & QA,","Employment TypeFull Time, Permanent",Role CategoryDevOps
Leading Client,"RoleSite Reliability Engineer,",Not Disclosed,2 - 4 years,Bangalore/Bengaluru,"Job descriptionJob Description :Our Client is a Product company, headquartered in London UK and developing an Ai powered enterprise platform that enables insurers the flexibility to scale capacity as needed, safely, securely, efficiently and at speed. Intelligent and flexible tool understands global insurance processing challenges, and seamlessly solves them. A smart and powerful modular SaaS platform that is built on robust technology, substantially minimizing time and money, whilst maximizing speed to market. Job Overview : As the SRE, you are responsible for application lifecycle and service management by incorporating various aspects of software development into IT operations. As an SRE you will be tasked with ensuring seamless collaboration between IT operations and development teams through the enhancement and automation of routine processes. Responsibilities and Duties : - Developing, configuring, and deploying platform to be used by operations teams - Handling support escalation issues - Conducting and reporting on incident reviews - Developing system documentation - Change management - Determining and validating new features and updates Skills, Education, Experience : - Languages : React.js, SQL, node.js - Cloud Experience : AWS (preferred) or any public cloud, ability to configure resources and services in public cloud - Experience : At least 2 to 3 years of experience in troubleshooting, L2 or L3 service engineer experience, must have supported multiple clients deployment and operations Position : Remote HybridReporting : Reports To Technology leadershipRoleSite Reliability Engineer,Industry TypeIT Services & Consulting,Functional AreaEngineering - Software & QA,Employment TypeFull Time, PermanentRole CategoryDevOpsEducationUG :B.Tech/B.E. in Any Specialization, BCA in Any Specialization, B.Sc in Any SpecializationPG :Any PostgraduateDoctorate :Doctorate Not RequiredKey Skillsnode.jsSite ReliabilityTechnical SupportIncident ManagementTroubleshootingReact.jsIT OperationsSQLSkills highlighted with ‘‘ are preferred keyskills","['node.js', 'Site Reliability', 'Technical Support', 'Incident Management', 'Troubleshooting', 'React.js', 'IT Operations', 'SQL']","['UG :B.Tech/B.E. in Any Specialization, BCA in Any Specialization, B.Sc in Any Specialization', 'PG :Any Postgraduate', 'Doctorate :Doctorate Not Required']","Industry TypeIT Services & Consulting,","Functional AreaEngineering - Software & QA,","Employment TypeFull Time, Permanent",Role CategoryDevOps
"[24]7.ai is redefining how artificial intelligence, human insight, and deep vertical expertise can produce personalized, satisfying customer experiences. Our advancedconversational AI platformpredicts consumer intent to create frictionless interactions that strengthen relationships and increase brand loyalty. Our significantcontact center expertiseenables us to deliver natural, consistent conversations across all digital and voice channels driving greater operational efficiencies. Whether you choose our SaaS platform, agent services or a managed service for your business, [24]7.ai is your trusted partner.","RoleSite Reliability Engineer,",Not Disclosed,4 - 7 years,Bangalore/Bengaluru,"Job description     Run the production environment by monitoring availability and taking a holistic view of system health.    Build software and systems to manage platform infrastructure and applications.    Improve reliability, quality, and time-to-market of our suite of software solutions.    Measure and optimize system performance, with an eye toward pushing our capabilities forward, getting ahead of customer needs, and innovating to continually improve.    Provide primary operational support and engineering for multiple large, distributed software applications.        Required Skills: -      Strong working knowledge of Red Hat Linux environments.    Good knowledge of Python, Bash shell script development.    Ability to program with one or more high level languages, such as Python, Perl, etc...    Experience with logging, monitoring, alerting and CICD Big data platform tools.    Strong communication and analytical/problem-solving skills.    Good understanding of Cloud Technologies like GCP, Azure.        Preferred Qualifications      Bachelor s degree in computer science or other highly technical, scientific discipline.    Previous success in technical engineering.    Coding experience beyond simple scripts.    Good understanding of networking concepts (load balancers, TCP/IP, Firewalls).    Logging and Monitoring tools like Logstash, Kibana, Grafana, etc...    Strong debugging skills.        Responsibilities:      Should flexible to work in 24X7 environment (rotational shifts).    Perform Incident Management and Change Management to maintain the continuous availability of all Cloud Infrastructure services.    Ensure all SRE and operating procedures are maintained and executed.    Work in partnership with stakeholders to design, implement, manage, and support a highly available and secure infrastructure.    Maintain 24x7 production environment with a high level of service availability and Perform quality reviews, manage operational issues.    Partner with development teams in defining and implementing improvements in service architecture.    Interface with Dev, QA, OPS teams to identify root cause analysis and re-instrument triggers to prevent future network degradation and outages.    Explore and innovate new cloud technologies, features, and tools to improve the platform and automate using Bash, Python or Perl, etc...    Implement automation and orchestration for manual processes required to operate and deploy cloud services, be at the heart of developing new ideas into internal tools by working closely with teams.    Partner with development teams to improve services through rigorous testing and release procedures.    Analyze alarms and dashboards to identify problem areas, report incidents, troubleshoot, and escalate as required.    Gather and analyze metrics from both operating systems and applications to assist in performance tuning and fault finding.    Perform ticket review and updates through JIRA ticketing tool.    Manage, coordinate, and document all type maintenances / events.    Must take initiative and be proactive.    Must take on the responsibility to learn new products and procedures.    Participate in system design consulting, platform management, and capacity planning.    Create sustainable systems and services through automation and uplifts.    Conducting post-incident reviews and creating actional reports and coming up with the application optimization recommendations for engineering teams.    Implementation of proactive monitoring, alerting, trend analysis and self-healing systems.    Understand the existing architecture and work with various Engineering teams to develop and execute strategies to provide a high-quality Global production service.    RoleSite Reliability Engineer,Industry TypeSoftware Product,Functional AreaEngineering - Software & QA,Employment TypeFull Time, PermanentRole CategoryDevOpsEducationUG :Any GraduatePG :Any PostgraduateKey SkillsPerformance tuningAutomationChange managementNetworkingCodingDebuggingConsultingPerlMonitoringPython","['Performance tuning', 'Automation', 'Change management', 'Networking', 'Coding', 'Debugging', 'Consulting', 'Perl', 'Monitoring', 'Python']","['UG :Any Graduate', 'PG :Any Postgraduate']","Industry TypeSoftware Product,","Functional AreaEngineering - Software & QA,","Employment TypeFull Time, Permanent",Role CategoryDevOps
