company,role,salary,experience,Location,description,skills,qualification,industry_type,Functional_area,Employment_type,Role_category
Flipkart Internet Private Limited,"RoleFull Stack Developer,",Not Disclosed,1 - 6 years,Bangalore/Bengaluru,"Job description       At Flipkart, Site reliability engineers (SREs) combine engineering experience and an innate drive to improve existing systems and processes, with the creativity to develop novel solutions to evolving challenges that can hamper reliability, performance and availability of critical platform services and applications.               SRE builds solutions (Process tools) to enhance the reliability posture of all critical platform services and applications. Improving uptime, availability, performance and stability of services and platform as well as automating repetitive work are the key goals to be worked upon.                The SRE team in FK searches for engineers who bring creative and innovative problem-solving, build,deploy the solution that operates at scale, and enjoys collaborating with a cross-functional team to develop real-world solutions and positive user experiences at every interaction.                What you ll do?                 Build software and systems to manage platform infrastructure and applications by using one or more programming languages (e.g. Go, Python, Java)               Observability tools and methodology (e.g. logging, metrics, tracing) for highly available web services               Designing and delivering cloud-native infrastructure solutions on top of Public Cloud or similar private cloud.                Ability/Experience with designing and managing large scale complex cloud based infrastructure and applications hosted on them.               Incident response and management in on-call rotation               Focus on 360 reliability posture to improve reliability, quality and performance of platform services and applications/microservices.               Measure and optimize system performance, with an eye toward pushing our capabilities forward, getting ahead of customer needs, and innovating to continually improve.               Understanding on reliability and resilience framework.               A proactive approach to spotting problems, areas for improvement, and performance bottlenecks                 What you ll need?                 Bachelor's or Master s degree in Computer Science/Information Technology, with 1 to 12 years of relevant industry experience.               Extensive coding experience in any one programming language like Python/Java/Go.               Ability to work with complex business flows and dealing with huge amounts of data.               Strong knowledge of OS (Linux/Unix preferably) and N/w topologies.               Full-stack troubleshooting skills across network, application, management fabric, and distributed services layers.               Drive efficiencies through software improvement and root cause analysis resulting in service delivery, maturity, and scalability.               Familiarity with hybrid, public and private cloud deployments and environments               Experience with cloud-agnostic configuration management frameworks for constructs like IaaC, Config Managements, Deployments etc               Awareness of containerization technologies (Docker, Kubernetes, etc)               Sound knowledge on               Observability              tools and APMs                Experience in Service Tiering and SLO/SLIs         RoleFull Stack Developer,Industry TypeInternet,Functional AreaEngineering - Software & QA,Employment TypeFull Time, PermanentRole CategorySoftware DevelopmentEducationUG :B.Tech/B.E.PG :Post Graduation Not RequiredKey SkillsUnixLinuxCodingProduct designPythonJava web servicesArtificial IntelligenceConfiguration managementCloudInformation technologySkills highlighted with ‘‘ are preferred keyskills","['Unix', 'Linux', 'Coding', 'Product design', 'Python', 'Java web services', 'Artificial Intelligence', 'Configuration management', 'Cloud', 'Information technology']","['UG :B.Tech/B.E.', 'PG :Post Graduation Not Required']","Industry TypeInternet,","Functional AreaEngineering - Software & QA,","Employment TypeFull Time, Permanent",Role CategorySoftware Development
Flipkart Internet Private Limited,"RoleSite Reliability Engineer,",Not Disclosed,1 - 6 years,Bangalore/Bengaluru,"Job description       At Flipkart, Site reliability engineers (SREs) combine engineering experience and an innate drive to improve existing systems and processes, with the creativity to develop novel solutions to evolving challenges that can hamper reliability, performance and availability of critical platform services and applications.               SRE builds solutions (Process tools) to enhance the reliability posture of all critical platform services and applications. Improving uptime, availability, performance and stability of services and platform as well as automating repetitive work are the key goals to be worked upon.                The SRE team in FK searches for engineers who bring creative and innovative problem-solving, build,deploy the solution that operates at scale, and enjoys collaborating with a cross-functional team to develop real-world solutions and positive user experiences at every interaction.                What you ll do?                 Build software and systems to manage platform infrastructure and applications by using one or more programming languages (e.g. Go, Python, Java)               Observability tools and methodology (e.g. logging, metrics, tracing) for highly available web services               Designing and delivering cloud-native infrastructure solutions on top of Public Cloud or similar private cloud.                Ability/Experience with designing and managing large scale complex cloud based infrastructure and applications hosted on them.               Incident response and management in on-call rotation               Focus on 360 reliability posture to improve reliability, quality and performance of platform services and applications/microservices.               Measure and optimize system performance, with an eye toward pushing our capabilities forward, getting ahead of customer needs, and innovating to continually improve.               Understanding on reliability and resilience framework.               A proactive approach to spotting problems, areas for improvement, and performance bottlenecks                 What you ll need?                 Bachelor's or Master s degree in Computer Science/Information Technology, with 1 to 12 years of relevant industry experience.               Extensive coding experience in any one programming language like Python/Java/Go.               Ability to work with complex business flows and dealing with huge amounts of data.               Strong knowledge of OS (Linux/Unix preferably) and N/w topologies.               Full-stack troubleshooting skills across network, application, management fabric, and distributed services layers.               Drive efficiencies through software improvement and root cause analysis resulting in service delivery, maturity, and scalability.               Familiarity with hybrid, public and private cloud deployments and environments               Experience with cloud-agnostic configuration management frameworks for constructs like IaaC, Config Managements, Deployments etc               Awareness of containerization technologies (Docker, Kubernetes, etc)               Sound knowledge on               Observability              tools and APMs                Experience in Service Tiering and SLO/SLIs         RoleSite Reliability Engineer,Industry TypeInternet,Functional AreaEngineering - Software & QA,Employment TypeFull Time, PermanentRole CategoryDevOpsEducationUG :B.Tech/B.E.PG :Post Graduation Not RequiredKey SkillsUnixLinuxCodingProduct designPythonArtificial IntelligenceConfiguration managementCloudprivate cloudInformation technologySkills highlighted with ‘‘ are preferred keyskills","['Unix', 'Linux', 'Coding', 'Product design', 'Python', 'Artificial Intelligence', 'Configuration management', 'Cloud', 'private cloud', 'Information technology']","['UG :B.Tech/B.E.', 'PG :Post Graduation Not Required']","Industry TypeInternet,","Functional AreaEngineering - Software & QA,","Employment TypeFull Time, Permanent",Role CategoryDevOps
"IBM has been present in India since 1992. IBM India's solutions and services span all major industries including financial services, healthcare, government, automotive, telecommunications and education, among others. As a trusted partner with wide-ranging service capabilities, IBM helps clients transform and succeed in challenging circumstances. IBM has been expanding its footprint in India - and has a presence in over 200 cities and towns across the country - either directly or through its strong business partner network. IBM India has clearly established itself as one of the leaders in the Indian Information Technology (IT) Industry - and continues to transform itself to align with global markets and geographies to grow this leadership position. Widely recognised as an employer of choice, IBM holds numerous awards for its industry-leading employment practices and policies. The diversity and breadth of the entire IBM portfolio of research, consulting, solutions, services, systems and software, uniquely distinguishes IBM India from other companies in the industry. To know more about business units at IBM India, click on the “About Us” link above.","RoleSite Reliability Engineer,",Not Disclosed,5 - 10 years,Bangalore/Bengaluru,"Job description            Design, Management, maintenance, and support of various virtualization solutions especially the RedHat OpenShift Virtualization (OSV) and VMware.                Create infrastructure using any from: Ansible, Terraform, Argo, OpenShift IPI, UPI, ZTP Zero Touch Provisioning               Operate in an agile manner and under strict change control               Maintain the environment according to the Policy Compliance Management requirements.               Troubleshoot and resolve Hypervisor/Operating System-based issues from Performance to Configuration               Backing up and protect virtual environments using platform-specific tools               Perform daily system checks, review and respond to events reflected in various management tools, perform server patch management.               Conduct system audit reviews and perform maintenance functions as required to ensure system health.               Troubleshoot and resolve problems for all applications.               Support, implement and maintain new applications coming into the environment.               Present status information on issues and problems at the weekly team meetings.               Document software changes.               Document problem resolution steps.               Assure best-practices and standards are implemented and adhered to for software systems               Provide on-call support and implementation after-hours on a rotating basis               Think and act like a Site Reliability Engineer (SRE) as the environment relates to virtualization           Required Technical and Professional Expertise             BS degree in computer science (or similar) or equivalent experience.               A minimum of 5 years experience in Virtualization & Automation as a      Site Reliability Engineer.               OpenShift / Kubernetes administration such as building, patching, debugging, and maintaining clusters               Strong understanding of Linux systems administration and operating system internals (Network management, standard processes, filesystems, namespaces, services, KVM)               Experience implementing Infrastructure as Code (IaC) with tools such as Terraform, Chef, Puppet, or Ansible               Experience designing, building, and supporting large-scale production systems               Independently identify critical areas of improvement and work across the team to implement your solutions in a collaborative way               Strong knowledge of server virtualization technology in VMware and cloud infrastructure               Experience and knowledge of systems and software monitoring tools and techniques               Strong Linux (RHEL) and system administration and networking skills               Strong problem solving and troubleshooting skills and experience integrating multiple software applications               Containerized Application experience, building containers, rolling out deployments, services, routes, pod-to-pod communication               Well-versed with Cluster Resource management and Cloud deployment               Experience or familiarity managing network devices and solutions such as Web Application Firewalls, Load Balancers or DNS servers               Experience with containers and cloud native development strategies using tools such as Docker, Podman           Preferred Technical and Professional Expertise             Installation, configuration, and deployment of Kubernetes or OpenShift clusters               Able to describe and traverse Kubernetes or OpenShift internals, deep familiarity with how a cluster works and the underlying architecture and its components               Ability to maintaining Linux systems such as CoreOS, RHEL or Ubuntu               Ability to debug Linux systems and their underlying processes               Ability to write processes or applications in Go, Ruby or Java               Achieved Kubernetes or OpenShift technical certifications (CKA, CKAD)               Familiarity or usage of the IBM Cloud platform and its catalog of services               Administration or usage of cloud native delivery solutions such as ArgoCD or Flux               Experience automating infrastructure, configuration management, testing, and deployments using tools like Ansible, Chef and can explain the Infrastructure as Code paradigm               A strong understanding of diverse infrastructure platforms and infrastructure concepts required.                Familiarity with managing and securing a distributed Windows Server and/or Linux environment               CICD Devops with Practical experience with or knowledge Git, Jenkins, Artifactory, Git, Artifactory, Jenkins, Maven, ELK        RoleSite Reliability Engineer,Industry TypeIT Services & Consulting,Functional AreaEngineering - Software & QA,Employment TypeFull Time, PermanentRole CategoryDevOpsEducationUG :Any GraduatePG :Any PostgraduateKey SkillsPatch managementVMwareNetworkingLinuxDesign managementCloudInfrastructureResource managementVirtualizationSkills highlighted with ‘‘ are preferred keyskills","['Patch management', 'VMware', 'Networking', 'Linux', 'Design management', 'Cloud', 'Infrastructure', 'Resource management', 'Virtualization']","['UG :Any Graduate', 'PG :Any Postgraduate']","Industry TypeIT Services & Consulting,","Functional AreaEngineering - Software & QA,","Employment TypeFull Time, Permanent",Role CategoryDevOps
"Thomson Reuters is a global leader in providing essential information to the world""s businesses and professionals in Law, Financial Services, Tax Accounting, Media News, Healthcare and Scientific Research. With our deep expertise and understanding of these professions, we are able to offer our customers a broad range of innovative products and services. The relevant, insightful information and intuitive supporting systems we provide enable our customers to be successful. Thomson Reuters has operations in 93 countries around the globe. More information about Thomson Reuters and its financial performance can be found on www.ThomsonReuters.com.","RoleSite Reliability Engineer,",Not Disclosed,7 - 10 years,Bangalore/Bengaluru,"Job description     You have..         Passion.    You are eager to learn new state of the art technologies, but also want to understand the business problems we are trying to solve. You are willing to question the status quo to find a more optimal solution to existing process. You are a strong advocate of DevOps and Cloud Technologies.        Teamwork.    You thrive in a positive, collaborative environment with your great communication skills. You believe in the value of iterating together towards a common goal.      The Site Reliability Engineer should have the ability to deliver high quality work on time in a high-energy environment while collaborating and brainstorming with operations and development staff in a dynamic team environment.      A combination of strong planning, organization, time management skills, and the ability to handle multiple projects are key. The Site Reliability Engineer will also contribute to the maintenance and support of production systems as necessary.        Requirements:      7+ years of experience writing   clean code in at least one modern system or scripting language such as: JavaScript, Python, Ruby...    Experienced automating software build, deployment and server configuration management using tools such as Puppet, Chef and Jenkins.     Expertise in Windows and Linux system administration, databases (relational and NoSQL), Web Servers (Apache, IIS), networking and storage technologies.     Experience with Cloud technologies and platforms such as AWS or Azure.     Experience and preference to work in an Agile environment, committed to continuously improve that environment.    RoleSite Reliability Engineer,Industry TypeBPO / Call Centre,Functional AreaEngineering - Software & QA,Employment TypeFull Time, PermanentRole CategoryDevOpsEducationUG :Any GraduatePG :Any PostgraduateKey SkillsIISNetworkingConfiguration managementJavascriptAgileData structuresWindowsApacheOpen sourcePython","['IIS', 'Networking', 'Configuration management', 'Javascript', 'Agile', 'Data structures', 'Windows', 'Apache', 'Open source', 'Python']","['UG :Any Graduate', 'PG :Any Postgraduate']","Industry TypeBPO / Call Centre,","Functional AreaEngineering - Software & QA,","Employment TypeFull Time, Permanent",Role CategoryDevOps
"At VMware, we believe that software has the power to unlock new opportunities for people and our planet. We look beyond the barriers of compromise to engineer new ways to make technologies work together seamlessly. Our compute, cloud, mobility, networking and security offerings form a digital foundation that powers the apps, services and experiences that are transforming the world.Since our founding over two decades ago, our 24,000+ employee community and ecosystem of 75,000 partners have been behind the technology innovations transforming entire industries from banking, healthcare, and government to retail, telecommunications, manufacturing, and transportation.","RoleProject Manager - Manufacturing,",Not Disclosed,5 - 8 years,Bangalore/Bengaluru,"Job description             Demonstrate knowledge of cloud architecture security, scaling, and management principles and have experience working with AWS, GCP, or Azure cloud infrastructures.        Contribute to the SaaS platform architectural strategy and roadmap that addresses our scalability, availability, performance, and cost objectives.        Work hand-in-hand with the development team to investigate platform issues and design/implement the necessary    solutions.          Work on solutions to allow our product to operate independent of the cloud provider platform.          What type of work will you be doing? What assignments, requirements, or skills will you be performing on a regular basis?           As a key member of Tanzu Observability team, you will:        Provide design documentation to support the SaaS architecture roadmap and work with the team to refine the effort so that it is Sprint ready.        Identify and drive adoption of the right tools to manage our services in production, keeping SLAs and MTTR top of mind        Participate in monthly roadmap planning to develop quarterly goals for the team.        Act as a leader on the team through mentoring others, working collaboratively with the team, and drive project scoping and execution.        Participate in the learning culture at Tanzu Observability and attend and maybe even give tech talks.        Be a self-starter with a high attention to detail.        Have good communication and presentation skills.        Be able to collaborate remotely via Slack/Zoom etc.        Once comfortable with travel and as supported by the company, be willing to travel occasionally for strategy sessions, team building events, etc.      RoleProject Manager - Manufacturing,Industry TypeSoftware Product,Functional AreaProject & Program Management,Employment TypeFull Time, PermanentRole CategoryConstruction / ManufacturingEducationUG :Any GraduatePG :Any PostgraduateKey SkillsVMwareAutomationArchitectureGCPSAASCloudReliability engineeringPurchase Managerinfrastructure servicesTeam building","['VMware', 'Automation', 'Architecture', 'GCP', 'SAAS', 'Cloud', 'Reliability engineering', 'Purchase Manager', 'infrastructure services', 'Team building']","['UG :Any Graduate', 'PG :Any Postgraduate']","Industry TypeSoftware Product,","Functional AreaProject & Program Management,","Employment TypeFull Time, Permanent",Role CategoryConstruction / Manufacturing
